comment_id,parent_id,author,score,body,created_utc,depth,permalink
n3f8739,t3_1m0t58w,MusicApollo93,1,"I’m so thankful for my new job that my boss is willing to work with me giving me my new schedule that is Sunday-Wednesday. It’s much nicer having three days off than the standard two days and I’m just happy I don’t have to deal with having a random schedule in retail anymore after I quit Walmart after eight years which was one of the happiest decisions of my life.

I much rather work four ten hour days just to get it all
over with.",1752661996.0,0,https://www.reddit.com/r/unpopularopinion/comments/1m0t58w/an_ideal_4day_work_week_would_have_wednesday_off/n3f8739/
n3f8sxy,t3_1m0t58w,PlumbutterOnToast,1,My schedule has been week-to-week for 27 years and it's rarely if ever a C&P of the previous week. If I didn't have a weekday off I don't know how I'd react.,1752662307.0,0,https://www.reddit.com/r/unpopularopinion/comments/1m0t58w/an_ideal_4day_work_week_would_have_wednesday_off/n3f8sxy/
n3f9cxo,t3_1m0t58w,jcoddinc,1,My favorite 4 day schedule i came across was mon-thur but is was staring at 7am on a 12-8-12-8 schedule. Monday could be a little rough but the rest was a breeze and it was always great starting the weekend at 3pm Thursday.,1752662588.0,0,https://www.reddit.com/r/unpopularopinion/comments/1m0t58w/an_ideal_4day_work_week_would_have_wednesday_off/n3f9cxo/
n3fanxl,t3_1m0t58w,smileyfaceleggings,1,Of course I read this Wednesday after my day off was just switched to Fridays lol,1752663217.0,0,https://www.reddit.com/r/unpopularopinion/comments/1m0t58w/an_ideal_4day_work_week_would_have_wednesday_off/n3fanxl/
n3fay53,t3_1m0t58w,Delta_Bearlines,1,I had this schedule in college and it was incredible.,1752663349.0,0,https://www.reddit.com/r/unpopularopinion/comments/1m0t58w/an_ideal_4day_work_week_would_have_wednesday_off/n3fay53/
n3fb04f,t3_1m0t58w,Spirited_Season2332,1,"I actually agree here. If my job ever went 4 days, I'd hope they would give us the choice cuz I would choose Wednesday over Friday every time",1752663376.0,0,https://www.reddit.com/r/unpopularopinion/comments/1m0t58w/an_ideal_4day_work_week_would_have_wednesday_off/n3fb04f/
n3fb4cr,t3_1m0t58w,Several-Signature583,1,I work 4 days but the off day rotates. If I am off Tuesday then next week I will be off Wednesday then the next week I will be off Thursday. When my off day lands on Friday then the next week I am off on Monday giving me a 4 day weekend every few weeks. It’s great.,1752663431.0,0,https://www.reddit.com/r/unpopularopinion/comments/1m0t58w/an_ideal_4day_work_week_would_have_wednesday_off/n3fb4cr/
n3fbh46,t3_1m0t58w,quasar_1618,1,"Upvote because this is definitely unpopular. 3 day weekends are nice because you have time to take occasional day trips. What can I do with one lonesome day in the middle of the week? Besides, while I don’t think 3 day weekends would make me worse at my job, Wednesdays off definitely would. It’s hard to maintain momentum when you only work at most 2 days in a row.",1752663593.0,0,https://www.reddit.com/r/unpopularopinion/comments/1m0t58w/an_ideal_4day_work_week_would_have_wednesday_off/n3fbh46/
n3fbriv,t3_1m0t58w,Jimlobster,1,You’re a madman,1752663726.0,0,https://www.reddit.com/r/unpopularopinion/comments/1m0t58w/an_ideal_4day_work_week_would_have_wednesday_off/n3fbriv/
n3fby0o,t3_1m0t58w,Competitive-Isopod74,1,Nope. I have worked all kinds of mixed 4-4.5 day workweeks.  3 day weekends rule.,1752663810.0,0,https://www.reddit.com/r/unpopularopinion/comments/1m0t58w/an_ideal_4day_work_week_would_have_wednesday_off/n3fby0o/
n3fc8sp,t3_1m0t58w,UdoBaumer,1,"I’ve been doing this for a while now! I totally agree with you, it’s optimal. At some point, I even rearranged everything so that I would work 3 days a week, but that meant working 12 hours at least one of those days, needless to say, it was awful.  4 work days, with a break in the middle is just perfect. 

…But then I decided it would be a good idea to get a masters degree & my week turned into absolute chaos; I’m slowly regaining my autonomy, as I finish it — my goal is to a) never work for a boss again and b) always have at least 2 days for myself.",1752663947.0,0,https://www.reddit.com/r/unpopularopinion/comments/1m0t58w/an_ideal_4day_work_week_would_have_wednesday_off/n3fc8sp/
n3fcgzw,t3_1m0t58w,Dependent-Plan-5998,1,"An ideal 4-day workweek should be tailored to each person. So on your free days, you will have stores, banks, hair salons, and so on open to do your non-work work.",1752664052.0,0,https://www.reddit.com/r/unpopularopinion/comments/1m0t58w/an_ideal_4day_work_week_would_have_wednesday_off/n3fcgzw/
n3fdjyj,t3_1m0t58w,BadChilii,1,"This is the objectively correct opinion, I've been on the Wednesday train for years.",1752664540.0,0,https://www.reddit.com/r/unpopularopinion/comments/1m0t58w/an_ideal_4day_work_week_would_have_wednesday_off/n3fdjyj/
n3fe9sx,t3_1m0t58w,Longjumping-Wish2432,1,"I work for cruise company (wfh) I work Fri -mon and off Tuesday, Wednesday, Thursday.
I work 10 hrs a day 9-7 . I love my days off",1752664859.0,0,https://www.reddit.com/r/unpopularopinion/comments/1m0t58w/an_ideal_4day_work_week_would_have_wednesday_off/n3fe9sx/
n3feekt,t3_1m0t58w,Titwag157,1,"I work condensed hours and have a Wednesday off. It is the best, only ever working 2 days in a row.",1752664917.0,0,https://www.reddit.com/r/unpopularopinion/comments/1m0t58w/an_ideal_4day_work_week_would_have_wednesday_off/n3feekt/
n3fem39,t3_1m0t58w,Azrial4real,1,I work 4 9s and one 4 my four hour day is Wednesday and I love it!!! I can do errands or set up dentist appointments or doctors appointments during the week and never have to use PTO for them it’s fantastic,1752665008.0,0,https://www.reddit.com/r/unpopularopinion/comments/1m0t58w/an_ideal_4day_work_week_would_have_wednesday_off/n3fem39/
n3fezr2,t3_1m0t58w,Fit-Abrocoma547,1,Mondays off is superior to Fridays off.,1752665174.0,0,https://www.reddit.com/r/unpopularopinion/comments/1m0t58w/an_ideal_4day_work_week_would_have_wednesday_off/n3fezr2/
n3ffvoq,t3_1m0t58w,Relative-Air-6648,1,"Agreed, I'm usually burnt out by Wednesday morning",1752665561.0,0,https://www.reddit.com/r/unpopularopinion/comments/1m0t58w/an_ideal_4day_work_week_would_have_wednesday_off/n3ffvoq/
n3ffz5y,t3_1m0t58w,Advocateforthedevil4,1,That’s tough because just 2 days off in a row sucks but only working 2 days in a row is nice.  I still think 3 day weekends would be best but that has its pros.  I work shift so I’ve worked all these scenarios but 12 hour shifts.  ,1752665603.0,0,https://www.reddit.com/r/unpopularopinion/comments/1m0t58w/an_ideal_4day_work_week_would_have_wednesday_off/n3ffz5y/
n3fgyho,t3_1m0t58w,JM3DlCl,1,My job just started a 9/80 schedule. I work 9 hour days and get every other friday off.,1752666020.0,0,https://www.reddit.com/r/unpopularopinion/comments/1m0t58w/an_ideal_4day_work_week_would_have_wednesday_off/n3fgyho/
n3fh7ib,t3_1m0t58w,awoloozlefinch,1,"I miss when I did 8 days on 6 days off. I had to sleep at work but it was in the wilderness so that was honestly a plus, and knowing I had 6 days all to myself made it so worth it.",1752666126.0,0,https://www.reddit.com/r/unpopularopinion/comments/1m0t58w/an_ideal_4day_work_week_would_have_wednesday_off/n3fh7ib/
n3fhl9q,t3_1m0t58w,Ballistic_86,1,"Who would this apply to? Is this the point of view of your typical office worker? What about retail/customer service/public transport/hospitals/trade jobs/child care/teachers?

Like, I get this and think the idea behind it is positive. But it sounds like it would only really apply to people who are mostly considered to have privileged jobs already. The “essential workers” of the pandemic would still be forced to work as much, or maybe more, if office workers were given another day off work. 

I think it could work better if there was some system that ensured only roughly 20% of the population could be off on the same day. Maybe anyone with kids has to arrange for one of the parents to be off when school is out during the week?",1752666284.0,0,https://www.reddit.com/r/unpopularopinion/comments/1m0t58w/an_ideal_4day_work_week_would_have_wednesday_off/n3fhl9q/
n3fi6g6,t3_1m0t58w,TheAhoAho,1,That's my schedule actually and yes its fantastic. Its genuinely the only reason I've been sane lol,1752666520.0,0,https://www.reddit.com/r/unpopularopinion/comments/1m0t58w/an_ideal_4day_work_week_would_have_wednesday_off/n3fi6g6/
n3fidea,t3_1m0t58w,straypatiocat,1,"i agree, a long time ago i had an in-office job with ""summer fridays"" and because everyone is on a team, everyone can't be off on the same day (fridays the most popular). i'd always take wednesday or thursday off.  monday was my first choice but was not allowed lol. 

wednesday break up the week well. thursday to a slight degree and no one does shit on fridays, especially in the summer, so id show up to the office with the majority of the people gone and just watch youtube/movies most of the day",1752666597.0,0,https://www.reddit.com/r/unpopularopinion/comments/1m0t58w/an_ideal_4day_work_week_would_have_wednesday_off/n3fidea/
n3fk3eo,t3_1m0t58w,ECO_212,1,"Idk. How it works currently, with a usual 5-day week I'd rather have a day off in the middle of the week than a longer weekend. But if we actually permanently get the 4-day week I'd rather have the long weekend.",1752667277.0,0,https://www.reddit.com/r/unpopularopinion/comments/1m0t58w/an_ideal_4day_work_week_would_have_wednesday_off/n3fk3eo/
n3fk6s1,t3_1m0t58w,stupidperson810,1,"While I don't disagree with you, people would never go for the split. I work in mining where we work 7 days on and 7 days off. The changing of rosters is always something that starts fights. Basically, people will eat shit while they're at work to get a longer days off. 

We used to work a different roster, 3 days, 2 nights 5 off with a day off between the days and nights. Similar to what you're suggesting. It was fantastic and I'd go back to it in a heartbeat, but in a vote, those for it lost terribly. 

A manager once described it that people don't look at the days on, only the days off. He said if he put up a roster of 21 on/21 off, plenty of people would vote for it, not thinking about working 21 12.75 hour shifts straight. 

I've been fighting rosters for 20 years. I'm tired boss, real tired.",1752667313.0,0,https://www.reddit.com/r/unpopularopinion/comments/1m0t58w/an_ideal_4day_work_week_would_have_wednesday_off/n3fk6s1/
n3fkdw8,t3_1m0t58w,WoodntULike2Know,1,"I don't care what day it is, I would love a 32 hour work week!",1752667390.0,0,https://www.reddit.com/r/unpopularopinion/comments/1m0t58w/an_ideal_4day_work_week_would_have_wednesday_off/n3fkdw8/
n3fklby,t3_1m0t58w,billydgibbons,1,"As a person with a 4 day work week, the split is garbage, youre not doing as much with that single day off as you can with 3 in a row, or in my case 4 in a row off",1752667472.0,0,https://www.reddit.com/r/unpopularopinion/comments/1m0t58w/an_ideal_4day_work_week_would_have_wednesday_off/n3fklby/
n3fkq80,t3_1m0t58w,scottabuckingham,1,"We've done this at my work since March 2020, and everyone loves it! 

Best for appointments and junk, only ever work 2 days in a row, and clients are totally understanding.

10/10 would recommend 👌",1752667524.0,0,https://www.reddit.com/r/unpopularopinion/comments/1m0t58w/an_ideal_4day_work_week_would_have_wednesday_off/n3fkq80/
n3flk7t,t3_1m0t58w,stlshlee,1,"Hard agree on Wednesdays. This is my current schedule 4x10 with Wednesday, Saturday and Sunday off.  I looove Wednesday off. Gives me a break mid week but it’s not long enough to cause me to be behind in anyway.  Plus I have j easier time making appointments mid week for some things than I did when I had Fridays off.",1752667843.0,0,https://www.reddit.com/r/unpopularopinion/comments/1m0t58w/an_ideal_4day_work_week_would_have_wednesday_off/n3flk7t/
n3fm084,t3_1m0t58w,Narrow_Turnip_7129,1,"Or, ideally, a choice?",1752668013.0,0,https://www.reddit.com/r/unpopularopinion/comments/1m0t58w/an_ideal_4day_work_week_would_have_wednesday_off/n3fm084/
n3fm0wm,t3_1m0t58w,crippled-crippler,1,"I work sunday - wednesday and have 3 days off its great.

Last few weeks i worked sat, sun, tues, wed and had the monday off in the middle. Not nearly as satisfying.",1752668020.0,0,https://www.reddit.com/r/unpopularopinion/comments/1m0t58w/an_ideal_4day_work_week_would_have_wednesday_off/n3fm0wm/
n3fmj1t,t3_1m0t58w,underwater-sunlight,1,"I had a shift pattern where I had a Monday off one week and a Friday the following week but worked the weekend.
I liked the long weekends but having Mondays off meant my leave entitlement was confusing as I was given additional but had to book it off for bank holidays.

I looked at a 4 day week and Wednesday would have been my choice as it splits the week. A Monday or Friday makes it easier to book a long weekend break but I'm sure I would have worked it out",1752668211.0,0,https://www.reddit.com/r/unpopularopinion/comments/1m0t58w/an_ideal_4day_work_week_would_have_wednesday_off/n3fmj1t/
n3fmriv,t3_1m0t58w,Naebany,1,"Both are great for different reasons. But the long weekend for little trips is much better. You can go every week to visit some friends in other cities. And you don't have to constantly take free days to do that. I often use 2 day weekends to go visit someone, sometimes I take 1 more day to make it 3 day weekend. With free Friday or Monday I could do that every week! And still have free days for longer trips.",1752668301.0,0,https://www.reddit.com/r/unpopularopinion/comments/1m0t58w/an_ideal_4day_work_week_would_have_wednesday_off/n3fmriv/
n3fnlg1,t3_1m0t58w,DropTablePosts,1,I'll take any 4 day work week at this point,1752668609.0,0,https://www.reddit.com/r/unpopularopinion/comments/1m0t58w/an_ideal_4day_work_week_would_have_wednesday_off/n3fnlg1/
n3fnq0o,t3_1m0t58w,Tabenes,1,"STFU. STFU. STFU!!!!

That's what I'm working towards. If I can't have that I want alternating Monday or Friday",1752668656.0,0,https://www.reddit.com/r/unpopularopinion/comments/1m0t58w/an_ideal_4day_work_week_would_have_wednesday_off/n3fnq0o/
n3fnz8f,t3_1m0t58w,Stavkot23,1,We just had a holiday on Tuesday earlier this month and it was way better than the typical long weekend.,1752668751.0,0,https://www.reddit.com/r/unpopularopinion/comments/1m0t58w/an_ideal_4day_work_week_would_have_wednesday_off/n3fnz8f/
n3fo9s3,t3_1m0t58w,Psychological-Cry221,1,"Hey look Man, someone needs to work Friday too so this is perfect.",1752668861.0,0,https://www.reddit.com/r/unpopularopinion/comments/1m0t58w/an_ideal_4day_work_week_would_have_wednesday_off/n3fo9s3/
n3fogms,t3_1m0t58w,TuringGoneWild,1,ChatGPT doesn't have weekends.,1752668932.0,0,https://www.reddit.com/r/unpopularopinion/comments/1m0t58w/an_ideal_4day_work_week_would_have_wednesday_off/n3fogms/
n3fp0k6,t3_1m0t58w,mercury228,1,"Yep,  i don't like working 4 10s in a row at all. You literally have no time at all on those days to do anything. I preferred having Wednesdays off instead.",1752669138.0,0,https://www.reddit.com/r/unpopularopinion/comments/1m0t58w/an_ideal_4day_work_week_would_have_wednesday_off/n3fp0k6/
n3fp20n,t3_1m0t58w,Ok_Willow6614,1,"As someone in the trades, this would be great. A mid week break to rest the body would go a long way IMO",1752669153.0,0,https://www.reddit.com/r/unpopularopinion/comments/1m0t58w/an_ideal_4day_work_week_would_have_wednesday_off/n3fp20n/
n3fpf72,t3_1m0t58w,PigletRivet,1,I can’t enjoy a day off from work when I have work the next day. That’s why Sundays are almost as bad as weekdays.,1752669288.0,0,https://www.reddit.com/r/unpopularopinion/comments/1m0t58w/an_ideal_4day_work_week_would_have_wednesday_off/n3fpf72/
n3fpgu6,t3_1m0t58w,otaconucf,1,"Yeah, no. First day to unwind, second day to actually relax and have fun, third day to gear up for going back in. Random day off in the middle doesn't allow for any kind of proper rest.",1752669305.0,0,https://www.reddit.com/r/unpopularopinion/comments/1m0t58w/an_ideal_4day_work_week_would_have_wednesday_off/n3fpgu6/
n3fpmiv,t3_1m0t58w,MGsubbie,1,"Absolutely agreed. Sleep in on Wednesday, so I'm not exhausted by the end of the week and miss a weekend day because of it.",1752669361.0,0,https://www.reddit.com/r/unpopularopinion/comments/1m0t58w/an_ideal_4day_work_week_would_have_wednesday_off/n3fpmiv/
n3fq36y,t3_1m0t58w,Pup5432,1,"Would take a Wednesday off in a heartbeat, it just breaks the week up",1752669525.0,0,https://www.reddit.com/r/unpopularopinion/comments/1m0t58w/an_ideal_4day_work_week_would_have_wednesday_off/n3fq36y/
n3fq71b,t3_1m0t58w,hardwood1979,1,"I'd imagine if a 4 day week became the norm businesses would like staff to take a variety of days off in order to keep business going with minimum disruption or need for additional hiring. If I was gonna get another day off I genuinely don't care when it is, change it every week for all I care.",1752669563.0,0,https://www.reddit.com/r/unpopularopinion/comments/1m0t58w/an_ideal_4day_work_week_would_have_wednesday_off/n3fq71b/
n3fqa77,t3_1m0t58w,pynergy1,1,"I've been working day off, 3 days work, day off, 2 days work for years now. Its significantly better. Any time I have to have a two day weekend, 5 days in a row feels like a soul crushing eternity. If you split the week up, you never feel too far from a day off.

Only downside is hangovers, though realistically I'd rather have a shitty hungover work day than waste a day off being hungover",1752669595.0,0,https://www.reddit.com/r/unpopularopinion/comments/1m0t58w/an_ideal_4day_work_week_would_have_wednesday_off/n3fqa77/
n3fqe1q,t3_1m0t58w,RiceRocketRider,1,I agree and have also noticed that this is a VERY unpopular opinion,1752669632.0,0,https://www.reddit.com/r/unpopularopinion/comments/1m0t58w/an_ideal_4day_work_week_would_have_wednesday_off/n3fqe1q/
n3fqllp,t3_1m0t58w,Fkingcherokee,1,"Just think of the weekends we could have if we had a day off while still in ""work mode."" My mid-week day off would be filled to the brim with my weekly chores so that I could have more fun/relaxation on the weekend. On a 3 day weekend you're more likely to ""maybe"" your chores the first two days and then spend the day before work stressing about getting it all done. 2-1-2-2 is definitely the way to go with the 4 day work week, it would even be more manageable when scheduling for a business that's open 7 days a week.",1752669707.0,0,https://www.reddit.com/r/unpopularopinion/comments/1m0t58w/an_ideal_4day_work_week_would_have_wednesday_off/n3fqllp/
n3fqs8h,t3_1m0t58w,Malthus777,1,This is the way. I work 4x10s and wed off is the best,1752669773.0,0,https://www.reddit.com/r/unpopularopinion/comments/1m0t58w/an_ideal_4day_work_week_would_have_wednesday_off/n3fqs8h/
n3frlxm,t3_1m0t58w,Extra_Shirt5843,1,"I actually agree.  I don't usually leave town or anything for the weekend, so having a catchup/break day in the middle of the week is a lot more helpful than just stacking another day on the weekend.  ",1752670060.0,0,https://www.reddit.com/r/unpopularopinion/comments/1m0t58w/an_ideal_4day_work_week_would_have_wednesday_off/n3frlxm/
n3fs54m,t3_1m0t58w,Rahikeru,1,"I watched a video about this recently (it's not really a very unpopular opinion). The argument is that you work 5 days, you're tired, you spend Saturday doing something without that much energy, and usually Sundays are quiet and a lot of shops close early.

Adding Friday to the mix only extends the things you can do by a little bit. A mid-week break keeps you energised to appreciate and spend the full two day weekend to the fullest.

This [video](https://youtu.be/ALaTm6VzTBw) by CGP Grey probably explains it a lot better.",1752670244.0,0,https://www.reddit.com/r/unpopularopinion/comments/1m0t58w/an_ideal_4day_work_week_would_have_wednesday_off/n3fs54m/
n3fssid,t3_1m0t58w,shitlord_god,1,"from a productivity standpoint this would be a disaster.

Edit: The wednesday part, not the three days off part.",1752670467.0,0,https://www.reddit.com/r/unpopularopinion/comments/1m0t58w/an_ideal_4day_work_week_would_have_wednesday_off/n3fssid/
n3ft5fn,t3_1m0t58w,LocoWolfe,1,My last job i worked 3 days in a row and had 4 days off. I miss it so bad,1752670588.0,0,https://www.reddit.com/r/unpopularopinion/comments/1m0t58w/an_ideal_4day_work_week_would_have_wednesday_off/n3ft5fn/
n3ftb76,t3_1m0t58w,Soft_Walrus_3605,1,I don't tend to take long weekend trips so this speaks to me. Wednesdays off breaking up the work week makes me feel like work isn't my full-time activity for some reason,1752670641.0,0,https://www.reddit.com/r/unpopularopinion/comments/1m0t58w/an_ideal_4day_work_week_would_have_wednesday_off/n3ftb76/
n3ftzcn,t3_1m0t58w,Ok-Slip-9844,1,"Ultimately I don’t care which day is off, a four day work week would be amazing. 

That said, while I see your point, I’d counter that if Fridays or Mondays were off we’d actually have one weekend day that isn’t adjacent to a workday. That beats out a midweek break for me. And if we had Fridays off, all of the Monday holidays in the US would become 4 day weekends which would be awesome (and also why I imagine if this ever happened we’d get Mondays).",1752670868.0,0,https://www.reddit.com/r/unpopularopinion/comments/1m0t58w/an_ideal_4day_work_week_would_have_wednesday_off/n3ftzcn/
n3fu8sw,t3_1m0t58w,DrCreepenVanPasta,1,"I'm contracted to work four days a week. I got to choose which day I didn't work and chose Wednesday. Perhaps the best thing about this arrangement is that almost everyone else chose Friday, and so little to nothing ever happens on Friday. Officially, I work Fridays, but I do absolutely nothing at least every other Friday.",1752670956.0,0,https://www.reddit.com/r/unpopularopinion/comments/1m0t58w/an_ideal_4day_work_week_would_have_wednesday_off/n3fu8sw/
n3fubbg,t3_1m0t58w,BullPropaganda,1,Nah fuck that,1752670980.0,0,https://www.reddit.com/r/unpopularopinion/comments/1m0t58w/an_ideal_4day_work_week_would_have_wednesday_off/n3fubbg/
n3fv0ft,t3_1m0t58w,jordnoetsmoer001,1,"Depends on the type of work really. When I did hospitality and had a 4 day work week that time off in the middle was a god send and I was chipper everyday. Now that I'm in IT i once tried tuesdays off because I thought it would benefit work and I...it didn't. Hard to mentally switch off when troubleshooting, as well as make sure your team is assigned work while your gone. Should've done Friday because less meetings + less likely a deployment will occur (less risk of breakages to fix)",1752671218.0,0,https://www.reddit.com/r/unpopularopinion/comments/1m0t58w/an_ideal_4day_work_week_would_have_wednesday_off/n3fv0ft/
n3fvfwp,t3_1m0t58w,lotuskid34,1,"Agreed. I used to do four ten hour shifts except my split was Friday Saturday off, work Sunday Monday, Tuesday off, work Wednesday Thursday. So same thing I worked two days then had a day off and it was a sweet schedule",1752671362.0,0,https://www.reddit.com/r/unpopularopinion/comments/1m0t58w/an_ideal_4day_work_week_would_have_wednesday_off/n3fvfwp/
n3fvuvh,t3_1m0t58w,PseudocodeRed,1,This makes sense only until you realize how much easier it is to plan vacations with a 3 day weekend.,1752671500.0,0,https://www.reddit.com/r/unpopularopinion/comments/1m0t58w/an_ideal_4day_work_week_would_have_wednesday_off/n3fvuvh/
n3fwn0u,t3_1m0t58w,KingOfWritersBlock,1,"Eh, as someone who had a schedule like that before, that mid week day off is not as restful as you think. You don't really get to enjoy the evening if you have to get up early for work, and a singular day off just does not give the same vibe as multiple days off in a row.

Also, if you wanted a five day vacation, you would be taking two days of pto for either schedule, so I don't really understand the addition of that to the post.",1752671759.0,0,https://www.reddit.com/r/unpopularopinion/comments/1m0t58w/an_ideal_4day_work_week_would_have_wednesday_off/n3fwn0u/
n3fwseg,t3_1m0t58w,bfrogsworstnightmare,1,"I’d rather Fridays still. Traffic is always the worst on Fridays, plus if I have a Monday holiday, then I have a 5 day weekend instead of coming in for one day, then have a day off and then 2 more days.",1752671808.0,0,https://www.reddit.com/r/unpopularopinion/comments/1m0t58w/an_ideal_4day_work_week_would_have_wednesday_off/n3fwseg/
n3fxlud,t3_1m0t58w,osmiumfeather,1,"As a lifelong 3 day weekender over the age of 50, yes this is an unpopular opinion.",1752672077.0,0,https://www.reddit.com/r/unpopularopinion/comments/1m0t58w/an_ideal_4day_work_week_would_have_wednesday_off/n3fxlud/
n3fyhcn,t3_1m0t58w,jigokusabre,1,"When I was doing 4/10s, I loved having Wednesday off. Totally recommended.",1752672362.0,0,https://www.reddit.com/r/unpopularopinion/comments/1m0t58w/an_ideal_4day_work_week_would_have_wednesday_off/n3fyhcn/
n3fynt7,t3_1m0t58w,Starry_Myliobatoidei,1,I like both so much I can’t pick one. When I worked 4 days a week I had off Wednesdays. Which for someone like me who always is seeing one specialist or another it was great not having to use sick time for a doctors visit (Fridays get booked quicker obviously) but also three days off in a row is immaculate.,1752672421.0,0,https://www.reddit.com/r/unpopularopinion/comments/1m0t58w/an_ideal_4day_work_week_would_have_wednesday_off/n3fynt7/
n3fyrun,t3_1m0t58w,High_Ground-,1,Im lucky to have this type of schedule and it’s exactly as great as you described.,1752672458.0,0,https://www.reddit.com/r/unpopularopinion/comments/1m0t58w/an_ideal_4day_work_week_would_have_wednesday_off/n3fyrun/
