comment_id,parent_id,author,score,body,created_utc,depth,permalink
n3d9xdg,t3_1m0t58w,TheVaultHommie,1,"You explain in a magnificent way, why wednesday off is so much better in the long term",1752628605.0,0,https://www.reddit.com/r/unpopularopinion/comments/1m0t58w/an_ideal_4day_work_week_would_have_wednesday_off/n3d9xdg/
n3da0ci,t3_1m0t58w,Oceanbreeze871,1,That’s a complete waste. A 3 day weekend allows you to take longer trips and such. A one day mid week does not,1752628634.0,0,https://www.reddit.com/r/unpopularopinion/comments/1m0t58w/an_ideal_4day_work_week_would_have_wednesday_off/n3da0ci/
n3dalga,t3_1m0t58w,Temnyj_Korol,1,"As somebody who still (somehow) parties a lot, i get a LOT more value out of a 3 day weekend than a mid week break.

3 day weekend gives me two whole days/nights of shenanigans, and still have a full day to recover/manage adulting before the new week.

From that perspective, a day in the middle of the week feels like a waste. I either have to try to cram all my adulting into that one day to get the same value for time, or just accept that Wednesday is a lazy day, and have less time for what i *want* to do on the weekend.

Different strokes for different folks, i guess.",1752628844.0,0,https://www.reddit.com/r/unpopularopinion/comments/1m0t58w/an_ideal_4day_work_week_would_have_wednesday_off/n3dalga/
n3damq1,t3_1m0t58w,ObservantWon,1,I agree with you.  Wednesday becomes a mini weekend.  Tuesday night becomes like another Friday night.,1752628856.0,0,https://www.reddit.com/r/unpopularopinion/comments/1m0t58w/an_ideal_4day_work_week_would_have_wednesday_off/n3damq1/
n3danvf,t3_1m0t58w,Striking-Smile-4019,1,"3 day weekend for traveling more.
And if stat holidays do not interfere with the 3 day weekends, then it becomes 4 day weekends. Use only 1 vacation day for a whole 5 day weekend trip get away. That's too good. 
Take my upvote op your opinion rly sucks",1752628867.0,0,https://www.reddit.com/r/unpopularopinion/comments/1m0t58w/an_ideal_4day_work_week_would_have_wednesday_off/n3danvf/
n3db42o,t3_1m0t58w,Cynyr36,1,Can i do 8 and 6?,1752629025.0,0,https://www.reddit.com/r/unpopularopinion/comments/1m0t58w/an_ideal_4day_work_week_would_have_wednesday_off/n3db42o/
n3dba2d,t3_1m0t58w,silvermoonbeats,1,"Honestly, yea. i work 4 10s at a vet clinic  monday-tuesday and thursday-friday. Its honestly great for one reason. ereands. I have one whole day in the middle of the week where i don't have to worry about shit being closed on weekends and there's normally plenty of avialbillity in mornings for things like barbers, doc offices, dentists ect... 
More normal errands like grocery store, gym, laudry are way less packed. And with a whole day in the middle of the week by the time i get to the weekends i can actually fukin enjoy them without stressing about the laundry list of adult BS i gotta get done when I'm not working. 


I personally like the work two days then take a break thing ive got going. but id personally say any of the three days that aren't monday or friday is great too have off for the same reasons. 

But yes, a day off in the middle of the week is vastly betterThen, tacking on friday for always.Having a three day weekend.",1752629083.0,0,https://www.reddit.com/r/unpopularopinion/comments/1m0t58w/an_ideal_4day_work_week_would_have_wednesday_off/n3dba2d/
n3dbgn4,t3_1m0t58w,calamityangie,1,"This opinion is popular with me!! I had this schedule once doing shift work and it was grand. Also, you can have a day to run errands at places like banks or doctor’s offices which are normally closed on Fridays and weekends.",1752629148.0,0,https://www.reddit.com/r/unpopularopinion/comments/1m0t58w/an_ideal_4day_work_week_would_have_wednesday_off/n3dbgn4/
n3dbjrn,t3_1m0t58w,Sabina282828,1,"I had this for a while and I hated it. I always felt disoriented about what day it was and while it did make Monday and Tuesday and Thursday and Friday more manageable because I had a chance to catch my breath, I couldn’t fully relax on Wednesdays because I was tired/dreading the work day after. It’s the worst solution.",1752629178.0,0,https://www.reddit.com/r/unpopularopinion/comments/1m0t58w/an_ideal_4day_work_week_would_have_wednesday_off/n3dbjrn/
n3dbxfn,t3_1m0t58w,maxxx_nazty,1,"This is correct. I have been working a Wednesdays-off schedule for two decades, it is fantastic. My workweeks are two days long, and there are rarely crowds wherever I spend my Wednesday.",1752629312.0,0,https://www.reddit.com/r/unpopularopinion/comments/1m0t58w/an_ideal_4day_work_week_would_have_wednesday_off/n3dbxfn/
n3dbxrn,t3_1m0t58w,WriteMyUsername8888,1,I have a four day work week and my chosen day off is Wednesday,1752629316.0,0,https://www.reddit.com/r/unpopularopinion/comments/1m0t58w/an_ideal_4day_work_week_would_have_wednesday_off/n3dbxrn/
n3dc1bv,t3_1m0t58w,BryGuy_2365,1,"That’s the one thing I miss about working retail. The random Tuesday, Wednesday or Thursday off.",1752629351.0,0,https://www.reddit.com/r/unpopularopinion/comments/1m0t58w/an_ideal_4day_work_week_would_have_wednesday_off/n3dc1bv/
n3dc36n,t3_1m0t58w,Glitch_on_Redd,1,"Hmm. I think we keep the weekend as typical days off, than we rotate so we all have a weekday for errands",1752629369.0,0,https://www.reddit.com/r/unpopularopinion/comments/1m0t58w/an_ideal_4day_work_week_would_have_wednesday_off/n3dc36n/
n3dc5jr,t3_1m0t58w,The_Dirty_Dangla,1,I work 5 days with Wednesday off and work Saturday. Love getting stuff done quick with little crowds during mid week and don’t feel like I miss a lot on Saturdays,1752629393.0,0,https://www.reddit.com/r/unpopularopinion/comments/1m0t58w/an_ideal_4day_work_week_would_have_wednesday_off/n3dc5jr/
n3ddmh0,t3_1m0t58w,gr3enw1lly,1,"You are correct. I work Monday, Tuesday, Thursday Friday, and it's fantastic. Been on it for over a year. And I don't think I'll give it up",1752629914.0,0,https://www.reddit.com/r/unpopularopinion/comments/1m0t58w/an_ideal_4day_work_week_would_have_wednesday_off/n3ddmh0/
n3ddv5h,t3_1m0t58w,Airblade101,1,"I actually kind of agree with you on this. At my last job, our vacation wasn't necessarily by weeks but by days and just to make it somewhat nice, I always took Wednesdays off if I did take the time because it was so much nicer working 2, off 1, working 2, off 2. I was able to get so much stuff done because I wasn't trying to do it after work or on the weekend with everyone else.

Obviously this would change if such a thing was implemented but I do agree that Wednesday is kind of ideal. People should try it some time, it really makes the week feel so much less daunting.",1752629998.0,0,https://www.reddit.com/r/unpopularopinion/comments/1m0t58w/an_ideal_4day_work_week_would_have_wednesday_off/n3ddv5h/
n3deglp,t3_1m0t58w,RealCanadianDragon,1,"I've always felt this way too.

With Monday or Friday off, it gets to the point where during the weekend you've basically done everything you've needed or wanted to do and the weekend just blends together.

With Wednesday off, you approach the week this way:

Monday (you didn't have work the day prior, and everyone's coming in to the day with the ""Monday feeling"")

Tuesday (while you had work yesterday, you don't have work tomorrow so that gives this a ""Friday feeling"")

Wednesday (obviously the day off is great to have and would feel almost like a Sunday)

Thursday (might partially feel like a Monday since you didn't have work the day prior, but you still have the usual Thursday feeling as the weeks almost over)

Friday (the same ""Friday feeling"" as usual)


And on top of that, there's 0 days under this schedule where you have 3 days of work in a row (meaning you worked yesterday, worked today and worked tomorrow) which happens 3 times under a normal 5 day work week, so a single day less of work gives you 3 fewer ""grind days"".",1752630203.0,0,https://www.reddit.com/r/unpopularopinion/comments/1m0t58w/an_ideal_4day_work_week_would_have_wednesday_off/n3deglp/
n3deio8,t3_1m0t58w,Pobb1eB0nk,1,"I had this once and it was beautiful.  2 days on, 1 day off, 2 days on, 2 days off.  Of course in between I was selling the devil's cable and contemplating what it would be like to swallow a few roofing nails",1752630223.0,0,https://www.reddit.com/r/unpopularopinion/comments/1m0t58w/an_ideal_4day_work_week_would_have_wednesday_off/n3deio8/
n3deixs,t3_1m0t58w,Walker_ID,1,I currently work 4 tens and I chose Wednesday off. Every one of my days is a Thursday or Friday. It's fucking glorious,1752630225.0,0,https://www.reddit.com/r/unpopularopinion/comments/1m0t58w/an_ideal_4day_work_week_would_have_wednesday_off/n3deixs/
n3deqlv,t3_1m0t58w,BizzyM,1,That's how I do my 4 day week.,1752630299.0,0,https://www.reddit.com/r/unpopularopinion/comments/1m0t58w/an_ideal_4day_work_week_would_have_wednesday_off/n3deqlv/
n3dez5h,t3_1m0t58w,ProjectTitan74,1,"I worked 4 10s for a few years and actually did what you're suggesting for a few months and it was noticeably worse.

The middle day doesn't feel very good because you just worked the previous day and you also have to work the next day. Imagine being tired from work on Saturday and having the Sunday scaries as well. I switched back to a three day weekend as quickly as I was allowed.",1752630379.0,0,https://www.reddit.com/r/unpopularopinion/comments/1m0t58w/an_ideal_4day_work_week_would_have_wednesday_off/n3dez5h/
n3df7dp,t3_1m0t58w,botw_bitch,1,"I think I have the best schedule, I do 3 12hr shifts one week then 4 the next. So I alternate between a 3 and 4 day weekend. And if i take one day off on my 3 day work week I get 5 days off in a row which honestly starts to feel like you don’t even have a job.",1752630458.0,0,https://www.reddit.com/r/unpopularopinion/comments/1m0t58w/an_ideal_4day_work_week_would_have_wednesday_off/n3df7dp/
n3dfe8q,t3_1m0t58w,jaking2017,1,I’ve never agreed with anything more. These people don’t know what they’re talking about. Your argument for the 5 day vacation alone should wake them up. Wednesday can be the chore day and you’d be able to enjoy the whole weekend stress free.,1752630525.0,0,https://www.reddit.com/r/unpopularopinion/comments/1m0t58w/an_ideal_4day_work_week_would_have_wednesday_off/n3dfe8q/
n3dfio8,t3_1m0t58w,jmagnabosco,1,"As someone who has tomorrow off for something sad, I completely agree!

It feels different but is so nice to know I don't have work tomorrow.",1752630567.0,0,https://www.reddit.com/r/unpopularopinion/comments/1m0t58w/an_ideal_4day_work_week_would_have_wednesday_off/n3dfio8/
n3dfk3m,t3_1m0t58w,renegade399,1,"Fri/Mon is superior for travelling and doing big weekend plans.


Wed is superior for catching up on things around the house, working out, etc.",1752630580.0,0,https://www.reddit.com/r/unpopularopinion/comments/1m0t58w/an_ideal_4day_work_week_would_have_wednesday_off/n3dfk3m/
n3dfwrm,t3_1m0t58w,Salty_Fox_6932,1,"Upvote. I travel a lot, flying out on Thursday and flying back on Sunday gives me two full days in another city.  Achieving this with a 40 hour work weeks feels like magic. I feel like I actually have an extra day in the week.",1752630701.0,0,https://www.reddit.com/r/unpopularopinion/comments/1m0t58w/an_ideal_4day_work_week_would_have_wednesday_off/n3dfwrm/
n3dg0fd,t3_1m0t58w,bob69joe,1,"I typically work 4 day weeks and normally have Fridays off. But sometimes any other day. Let me say having the day off in the middle of the week is just terrible compared to 3 days off in a row. 

With Fridays off I can sleep in Friday, do some errands, similar and often my friends can get off work early to hang out. Then on Saturday I can get up early to workout with my group, spend time with family the rest of the day. Then on Sunday I can relax and get fully rested for work.

For Wednesday off I sleep in trying to catch up on sleep, but usually because I know that I have work the next day and all my friends are working, I don’t feel motivated to do anything and just waste the whole day. Then on the normal weekend I don’t have enough time and must choose between relaxing and doing stuff and then start work tired Monday.",1752630736.0,0,https://www.reddit.com/r/unpopularopinion/comments/1m0t58w/an_ideal_4day_work_week_would_have_wednesday_off/n3dg0fd/
n3dg1ix,t3_1m0t58w,ValuableNail8981,1,"I had a 4 day work week and Tuesday was my favorite day off. Work Monday, Tuesday off. back to work on Wednesday, week 1/2 over.Thursday and Friday fly by. Back to the weekend. Also since so many holidays fall on Monday, wound up with a mini vacation 4 days off and not touching PTO. Those were the days. 52 extra days off a year.",1752630747.0,0,https://www.reddit.com/r/unpopularopinion/comments/1m0t58w/an_ideal_4day_work_week_would_have_wednesday_off/n3dg1ix/
n3dgadc,t3_1m0t58w,numbersthen0987431,1,"I worked at a company where we did 4x10s, and the extra day off rotated between us (so we'd have someone working on those days). We'd rotate M>F>W>M>etc. 

Friday off wasn't bad, but it was over-rated. 3 day weekends are good and all, but since everyone else I knew was working on Fridays I just ended up waiting for everyone to start the weekend 

Wednesdays were nice to have off, but it wasn't worth it. You lose your momentum, and having the 1 day off kinda sucks because you can't really treat it like a mini weekend (Tuesday isn't Friday, Wednesday isn't Saturday nor Sunday). 

Mondays were the best though. You'd still get the 3 day weekend, you see your friends and enjoy the time off, and then on Sunday you don't have to worry about going back to work.",1752630831.0,0,https://www.reddit.com/r/unpopularopinion/comments/1m0t58w/an_ideal_4day_work_week_would_have_wednesday_off/n3dgadc/
n3dgd2t,t3_1m0t58w,BelligerentWyvern,1,"Realistically a 4 day work week would have sufficient coverage for any day to take into account all those off but still requiring service.

A quick and easy patch would be to have alternative three 12 hour shifts and dont run on the 7 day week at all. 3 on, 3 off. This will result in 3 weeks where you work 4 days and 3 weeks where you have off 4 days.thisnwould work for 24 hour operations too.

Not every job is conducive to 12 hour shifts sadly but that would be the best. You simply get more time off to actually unwind and do tasks outside of work. It make scheduling labor easier too including vacations",1752630857.0,0,https://www.reddit.com/r/unpopularopinion/comments/1m0t58w/an_ideal_4day_work_week_would_have_wednesday_off/n3dgd2t/
n3dggdp,t3_1m0t58w,Vader1977b,1,"I havent had a weekend off (outside of request) in 15+ years.  Pretty sure us underlings would still be without 3 days in a row off.  More time off for the midclass, the more working class schedules would be messed up.  Holidays and most weekends are already a mess, couldnt imagine the mess from regular 3 day weekends...  example: how many people on this thread have already commented 'a day to run errands'",1752630889.0,0,https://www.reddit.com/r/unpopularopinion/comments/1m0t58w/an_ideal_4day_work_week_would_have_wednesday_off/n3dggdp/
n3dggec,t3_1m0t58w,matzau,1,No way.,1752630889.0,0,https://www.reddit.com/r/unpopularopinion/comments/1m0t58w/an_ideal_4day_work_week_would_have_wednesday_off/n3dggec/
n3dgqql,t3_1m0t58w,Corgsploot,1,I'm with ya,1752630990.0,0,https://www.reddit.com/r/unpopularopinion/comments/1m0t58w/an_ideal_4day_work_week_would_have_wednesday_off/n3dgqql/
n3dgr6w,t3_1m0t58w,Strong_Sir_8404,1,I just quit so its all days off now,1752630994.0,0,https://www.reddit.com/r/unpopularopinion/comments/1m0t58w/an_ideal_4day_work_week_would_have_wednesday_off/n3dgr6w/
n3dh0dg,t3_1m0t58w,Neuvirths_Glove,1,I work four tens Monday through Thursday and I like it just fine.,1752631082.0,0,https://www.reddit.com/r/unpopularopinion/comments/1m0t58w/an_ideal_4day_work_week_would_have_wednesday_off/n3dh0dg/
n3dhm6m,t3_1m0t58w,RaincoatBadgers,1,"Nah this is stupid 

The whole point of consequitive days is to experience a long break from work to recover",1752631293.0,0,https://www.reddit.com/r/unpopularopinion/comments/1m0t58w/an_ideal_4day_work_week_would_have_wednesday_off/n3dhm6m/
n3di67i,t3_1m0t58w,SodaCake2,1,I actually have tomorrow off because of this very reason! I tried taking a Wednesday off last year to try it out and I've been sold ever since. I agree with you 100%,1752631488.0,0,https://www.reddit.com/r/unpopularopinion/comments/1m0t58w/an_ideal_4day_work_week_would_have_wednesday_off/n3di67i/
n3didi3,t3_1m0t58w,The-Spaceman,1,"I had this schedule once and it was glorious.  8-6:45pm Mon, Tues, Thurs, Friday.  Had Wednesdays and weekends off.  We called it the donut schedule.  Having that hole in the middle of the week was a great refresher.  I'd happily do it again if I could.",1752631561.0,0,https://www.reddit.com/r/unpopularopinion/comments/1m0t58w/an_ideal_4day_work_week_would_have_wednesday_off/n3didi3/
n3dieyt,t3_1m0t58w,wumbologist-2,1,What kind of insanity is this?,1752631575.0,0,https://www.reddit.com/r/unpopularopinion/comments/1m0t58w/an_ideal_4day_work_week_would_have_wednesday_off/n3dieyt/
n3disn6,t3_1m0t58w,ImNotThaaatDrunk,1,Hey so I'm currently working a job where I have Wednesdays off in the middle of my week and I do not care for it. I would rather have more consecutive time off than a do-nothing day that throws off my rhythm.,1752631708.0,0,https://www.reddit.com/r/unpopularopinion/comments/1m0t58w/an_ideal_4day_work_week_would_have_wednesday_off/n3disn6/
n3diu1s,t3_1m0t58w,Cool-Presentation538,1,My weekend is Tuesday Wednesday and it's the best,1752631722.0,0,https://www.reddit.com/r/unpopularopinion/comments/1m0t58w/an_ideal_4day_work_week_would_have_wednesday_off/n3diu1s/
n3divvm,t3_1m0t58w,janlep,1,"I’ve had 4-day weeks with Mondays, Wednesdays, and Fridays off at various times in my career. I once thought like you do, but then I learned a 3-day weekend every week is amazing. I’ll take a Friday or Monday off over Wed anytime.",1752631740.0,0,https://www.reddit.com/r/unpopularopinion/comments/1m0t58w/an_ideal_4day_work_week_would_have_wednesday_off/n3divvm/
n3dj5u3,t3_1m0t58w,JustTheBeerLight,1,Fuck that. Give me 3-day weekends.,1752631840.0,0,https://www.reddit.com/r/unpopularopinion/comments/1m0t58w/an_ideal_4day_work_week_would_have_wednesday_off/n3dj5u3/
n3dj8ot,t3_1m0t58w,FrankieBeanzie,1,Monday Tuesday Wednesday off so I can get shit done,1752631869.0,0,https://www.reddit.com/r/unpopularopinion/comments/1m0t58w/an_ideal_4day_work_week_would_have_wednesday_off/n3dj8ot/
n3dj9dg,t3_1m0t58w,Hurtkopain,1,I've always been doing one day on one day off and I couldn't think of a better balance. if companies would offer that kind of schedule they would keep their employees happy and healthy.,1752631876.0,0,https://www.reddit.com/r/unpopularopinion/comments/1m0t58w/an_ideal_4day_work_week_would_have_wednesday_off/n3dj9dg/
n3djk9d,t3_1m0t58w,ndiasSF,1,"I had a colleague who had to do this during the height of COVID for childcare reasons. Everything was so disjointed for him. He’d get started, be out, and then come back to more work. Now if the whole office was closed, it would be better but in an office environment where people have to work together, if sucked.

On the other side, my mom was in customer service and had Thursdays off for years. It broke up her week, she could come in on Friday and wrap up everything for the weekend. She loved it. She also could get errands done during a less busy time. 

I like the idea but it depends on who else is working and what type of job.",1752631983.0,0,https://www.reddit.com/r/unpopularopinion/comments/1m0t58w/an_ideal_4day_work_week_would_have_wednesday_off/n3djk9d/
n3djtmu,t3_1m0t58w,PandahHeart,1,Sometimes I wish it was like this honestly lol. A little break in the work week sounds nice,1752632077.0,0,https://www.reddit.com/r/unpopularopinion/comments/1m0t58w/an_ideal_4day_work_week_would_have_wednesday_off/n3djtmu/
n3dk7ld,t3_1m0t58w,mb9981,1,"This is the ultimate monkeys paw and no one sees it coming. 

4 day work weeks will mean a lot of people suddenly finding themselves on wednesday- Saturday or Sunday- Wednesday schedules now because the concept of ""what's a weekend?"" Is suddenly up for debate",1752632216.0,0,https://www.reddit.com/r/unpopularopinion/comments/1m0t58w/an_ideal_4day_work_week_would_have_wednesday_off/n3dk7ld/
n3dkab0,t3_1m0t58w,pissfucked,1,had to downvote because i agree so much 😭,1752632244.0,0,https://www.reddit.com/r/unpopularopinion/comments/1m0t58w/an_ideal_4day_work_week_would_have_wednesday_off/n3dkab0/
n3dkcw5,t3_1m0t58w,Throwaway9028273738,1,! Funny I’ve always thought the same thing and I just changed my schedule to this recently… its amazing,1752632270.0,0,https://www.reddit.com/r/unpopularopinion/comments/1m0t58w/an_ideal_4day_work_week_would_have_wednesday_off/n3dkcw5/
n3dko35,t3_1m0t58w,ktb609,1,My mom worked part time growing up with a MoTuTh schedule and I have always thought is ideal!!,1752632382.0,0,https://www.reddit.com/r/unpopularopinion/comments/1m0t58w/an_ideal_4day_work_week_would_have_wednesday_off/n3dko35/
n3dl093,t3_1m0t58w,Death_Balloons,1,"I don't have a 4-day work week, but I did switch from having Saturday/Sunday off to having Wednesday/Sunday off. I actually really like having two smaller work chunks and getting a day off every couple of days.

So I actually agree with you. If I ever had a four-day work week I would rather have Wednesdays off than three days in a row.

(Nah. Just kidding, having Friday, Saturday, Sunday off every week would be sick. I really couldn't possibly argue with that )",1752632506.0,0,https://www.reddit.com/r/unpopularopinion/comments/1m0t58w/an_ideal_4day_work_week_would_have_wednesday_off/n3dl093/
n3dl5j6,t3_1m0t58w,slayer_of_idiots,1,The least productive days are Mondays and fridays. Mondays because you’re trying to get back into the work routine and fridays because you just want to the weekend. Having every day effectively be a Monday or Friday sounds like a recipe for fuck-all getting done.,1752632558.0,0,https://www.reddit.com/r/unpopularopinion/comments/1m0t58w/an_ideal_4day_work_week_would_have_wednesday_off/n3dl5j6/
n3dlq06,t3_1m0t58w,elusivenoesis,1,"This discussion never includes the massive amount of retail/service/hospitality/trade etc workers, that simply don't get weekends off, or the johnny 9 to 5's wouldn't have anything to do or even function on their days off.

It also ignores the people who are damn near full time, but get screwed out of benefits because they only get scheduled for 29.5 hours a week (or whatever the cutoff is now for the ACA)..",1752632763.0,0,https://www.reddit.com/r/unpopularopinion/comments/1m0t58w/an_ideal_4day_work_week_would_have_wednesday_off/n3dlq06/
n3dlsiu,t3_1m0t58w,delaranta,1,"You should go Monday to Thursday one week and Tuesday to Friday the next. Two teams are on alternating schedules. The company gets productivity for all five of the days and most days are fully staffed. Employees get a long weekend every other week, and a couple days of PTO can get you a full week off.",1752632789.0,0,https://www.reddit.com/r/unpopularopinion/comments/1m0t58w/an_ideal_4day_work_week_would_have_wednesday_off/n3dlsiu/
n3dm1de,t3_1m0t58w,CurtWesticles,1,I really enjoyed having Wednesdays and weekends off. Scheduling appointments and doing stuff while places are open during the week was a breeze. Still had the weekend for relaxation too.,1752632879.0,0,https://www.reddit.com/r/unpopularopinion/comments/1m0t58w/an_ideal_4day_work_week_would_have_wednesday_off/n3dm1de/
n3dm9zi,t3_1m0t58w,None,1,This is a terrible opinion. Great job. ,1752632967.0,0,https://www.reddit.com/r/unpopularopinion/comments/1m0t58w/an_ideal_4day_work_week_would_have_wednesday_off/n3dm9zi/
n3dmast,t3_1m0t58w,wrongsuspenders,1,"I like Mondays off when others do not have the day off. Shopping is easier, and sunday is wonderful!",1752632975.0,0,https://www.reddit.com/r/unpopularopinion/comments/1m0t58w/an_ideal_4day_work_week_would_have_wednesday_off/n3dmast/
n3dmb8u,t3_1m0t58w,Vherene,1,"Currently forced into that situation. I wanted both fridays off, instead I got Friday and Tuesday off.

Bright side? If I call out or take leave Monday I have a 5 day weekend.

Negative? My other weekend, the two day, feels a bit lonely.",1752632979.0,0,https://www.reddit.com/r/unpopularopinion/comments/1m0t58w/an_ideal_4day_work_week_would_have_wednesday_off/n3dmb8u/
n3dmeh6,t3_1m0t58w,AdagiaFane,1,"Part of the benefit of having a four-day work week is that you have a weekday off to run errands, schedule appts, etc.. For this to work if all / most are on the same schedule, with Wednesdays off, Wednesday becomes a defacto weekend day. More shops are closed, more crowded public spaces, hard to find open Dr offices.

Have Wednesday, I'm taking Tuesday.",1752633013.0,0,https://www.reddit.com/r/unpopularopinion/comments/1m0t58w/an_ideal_4day_work_week_would_have_wednesday_off/n3dmeh6/
n3dmi0m,t3_1m0t58w,codsildk,1,"Currently have a job where I work 4 days split between the days Mon-Sat. My favorite weeks are definitely 3 day (or occasionally 4 or 5 day) weekend weeks, but I do agree that a 2-2 day split can be nice. Outside of weeks I have to work Saturday, my least favorite weeks are weeks where my weekday off is Tuesday or Thursday. Feels like a waste.",1752633049.0,0,https://www.reddit.com/r/unpopularopinion/comments/1m0t58w/an_ideal_4day_work_week_would_have_wednesday_off/n3dmi0m/
n3dmi4t,t3_1m0t58w,MyDogsNameIsToes,1,I have to agree. Tuesdays suck ass. I'd love to have Wednesday off. ,1752633050.0,0,https://www.reddit.com/r/unpopularopinion/comments/1m0t58w/an_ideal_4day_work_week_would_have_wednesday_off/n3dmi4t/
