comment_id,parent_id,author,score,body,created_utc,depth,permalink
n3gig23,t1_n3byyoj,Fitzgerald1896,10,"Yeah, same. I worked 4-10s w/ Wednesday off for years pre-covid and it was awesome. 

The '2 Fridays & 2 Mondays' bit is the best part. You really do get that ""aaaayyy it's Friday!"" feeling on Tuesdays lol. And never working more than 2 days in a row? It's fantastic.

You don't need the ""refreshing 3 day weekends"" because you just never feel burnt out. And then when you *did* get long weekends for holidays? Then your work week was like work Mon/Tues, day off Wed, work Thurs, then Fri/Sat/Sun off... So holiday long weekends felt even *more* refreshing. 

Not to mention if you had vacation time too you could easily take 1 day off for that long weekend Thursday and you'd be off from Tuesday evening until the following Monday with only 1 vacation day used!",1752678283.0,1,https://www.reddit.com/r/unpopularopinion/comments/1m0t58w/an_ideal_4day_work_week_would_have_wednesday_off/n3gig23/
n3feimh,t1_n3byyoj,Cynykl,4,On the downside you have 2 mondays. On the plus side 2 fridays.,1752664966.0,1,https://www.reddit.com/r/unpopularopinion/comments/1m0t58w/an_ideal_4day_work_week_would_have_wednesday_off/n3feimh/
n3go3nv,t1_n3byyoj,Free-Tea-3422,3,Yes I want this so bad!,1752679836.0,1,https://www.reddit.com/r/unpopularopinion/comments/1m0t58w/an_ideal_4day_work_week_would_have_wednesday_off/n3go3nv/
n3dcq5a,t1_n3byyoj,PyrZern,2,"I actually get Tuesday and Wednesday off every week right now, tho I work Sunday instead. I like my setup a lot. 3 days off in a row is too much for me. O",1752629600.0,1,https://www.reddit.com/r/unpopularopinion/comments/1m0t58w/an_ideal_4day_work_week_would_have_wednesday_off/n3dcq5a/
n3hccf3,t1_n3byyoj,RdoubleM,1,But where would you be having those appointments if that was the norm for everyone else?,1752687851.0,1,https://www.reddit.com/r/unpopularopinion/comments/1m0t58w/an_ideal_4day_work_week_would_have_wednesday_off/n3hccf3/
n3he9vr,t1_n3byyoj,Omnomnomnosaurus,1,"I have Wednesdays off and love it! I never work more than two days in a row. It's like, work for two days.. have one day off.. work for two days.. the weekend! I go to the gym on Wednesday morning, after that I clean the house (so husband and I have the whole weekend to do fun stuff) and then I have all afternoon to myself. I am never going back to a fulltime job!",1752688362.0,1,https://www.reddit.com/r/unpopularopinion/comments/1m0t58w/an_ideal_4day_work_week_would_have_wednesday_off/n3he9vr/
n3huont,t1_n3byyoj,smangela69,1,i’m not even off on wednesdays but i do work from home wednesdays and even that makes a world of a difference for my mental health,1752692888.0,1,https://www.reddit.com/r/unpopularopinion/comments/1m0t58w/an_ideal_4day_work_week_would_have_wednesday_off/n3huont/
n3bz0ue,t1_n3bv80p,MstrNixx,211,With Wednesday off you’d still get the occasional three day weekend. With various Sundays and Fridays off for whatever civic or religious holidays.,1752613237.0,1,https://www.reddit.com/r/unpopularopinion/comments/1m0t58w/an_ideal_4day_work_week_would_have_wednesday_off/n3bz0ue/
n3c3yfx,t1_n3bv80p,Push_Bright,3,Especially because if three days off still feels too short then obviously two days would be worse. OP shot their own argument in the face.,1752614670.0,1,https://www.reddit.com/r/unpopularopinion/comments/1m0t58w/an_ideal_4day_work_week_would_have_wednesday_off/n3c3yfx/
n3ebda9,t1_n3bv80p,PythagorasNintyOne,2,"Uhhh, am I missing something? OP is NOT advocating for 3 day weekends…",1752643777.0,1,https://www.reddit.com/r/unpopularopinion/comments/1m0t58w/an_ideal_4day_work_week_would_have_wednesday_off/n3ebda9/
n3hh5c2,t1_n3bv80p,PatHeist,1,"In Sweden we have a thing called ""klämdagar"" (squeeze days) where people take the day off if a single non-holiday falls between a holiday and another holiday or weekend. Schools and a lot of workplaces also give these days off, so we end up with quite a few 4 day weekends. 

People often use these for a mini-vacation, like going to a ski resort if it's winter.

It's very nice, but I still agree with OP that a day to recover in the middle of the week is way nicer than long weekends for an every week thing. The ideal setup would having the extra day off be flexible so you could have a long weekend every once in a while.",1752689140.0,1,https://www.reddit.com/r/unpopularopinion/comments/1m0t58w/an_ideal_4day_work_week_would_have_wednesday_off/n3hh5c2/
n3ipcld,t1_n3bv80p,CromTheConqueror,1,All these people talking about 3 day weekends.  I'd be thrilled with just 2.,1752701389.0,1,https://www.reddit.com/r/unpopularopinion/comments/1m0t58w/an_ideal_4day_work_week_would_have_wednesday_off/n3ipcld/
n3bz0ay,t1_n3by29p,SetSilly5744,205,Exactly. Still checking my emails and such because what’s 24 hours gonna do for me smack dab in the middle of the week???,1752613232.0,1,https://www.reddit.com/r/unpopularopinion/comments/1m0t58w/an_ideal_4day_work_week_would_have_wednesday_off/n3bz0ay/
n3c9slj,t1_n3by29p,Real_Buff_Wizard,18,"Having three days straight is also better for planning trips, events, etc",1752616420.0,1,https://www.reddit.com/r/unpopularopinion/comments/1m0t58w/an_ideal_4day_work_week_would_have_wednesday_off/n3c9slj/
n3e4es0,t1_n3by29p,TheHB36,4,"I mean the reality is that you can't have everyone in the work force taking the same days off, and that's already how things function. Standardizing it as Monday or Friday makes far more sense for the standard 9-5 business world though because of momentum, and as you said, emails n shit. It makes more sense for a lot of jobs to work straight through and then switch off for 3 days.",1752640177.0,1,https://www.reddit.com/r/unpopularopinion/comments/1m0t58w/an_ideal_4day_work_week_would_have_wednesday_off/n3e4es0/
n3cjmsp,t1_n3by29p,Fake_Account30,9,"Yea, I don’t need a second day during the week that I spend dreading going back to work the next day.",1752619674.0,1,https://www.reddit.com/r/unpopularopinion/comments/1m0t58w/an_ideal_4day_work_week_would_have_wednesday_off/n3cjmsp/
n3dbxx0,t1_n3by29p,MegaSquishyMan,2,Idk…Two fridays (and every “Monday” you know tomorrow is “Friday”)…One random day to get your chores done so you can have a proper weekend of two days in a row to relax or socialize…,1752629317.0,1,https://www.reddit.com/r/unpopularopinion/comments/1m0t58w/an_ideal_4day_work_week_would_have_wednesday_off/n3dbxx0/
n3ebjxc,t1_n3by29p,PythagorasNintyOne,1,"Exactly. Everyone hates sundays because all you think about is worth the next day. So in addition to destroying the flexibility of a 3 day weekend, you’re giving us technically a “second Sunday” so we can have a “second Friday?” Hard pass. This is some r/im14andthisisdeep level of post",1752643871.0,1,https://www.reddit.com/r/unpopularopinion/comments/1m0t58w/an_ideal_4day_work_week_would_have_wednesday_off/n3ebjxc/
n3enks6,t1_n3by29p,savbh,1,Difference: there’s only 2 days of work you need to forget about instead of 5.,1752650282.0,1,https://www.reddit.com/r/unpopularopinion/comments/1m0t58w/an_ideal_4day_work_week_would_have_wednesday_off/n3enks6/
n3exy8x,t1_n3by29p,FBI-INTERROGATION,1,Spoken like someone who doesnt do any physical work,1752656289.0,1,https://www.reddit.com/r/unpopularopinion/comments/1m0t58w/an_ideal_4day_work_week_would_have_wednesday_off/n3exy8x/
n3k6nxg,t1_n3by29p,Jconstant33,1,Exactly plus you can’t go on a trip on just a Wednesday off. 3 day trips open a lot more possibilities than just 2 days.,1752719056.0,1,https://www.reddit.com/r/unpopularopinion/comments/1m0t58w/an_ideal_4day_work_week_would_have_wednesday_off/n3k6nxg/
n3ll846,t1_n3by29p,ChokaMoka1,1,Yea OP’s argument is like saying I’ll have desert in the middle of my meal,1752743472.0,1,https://www.reddit.com/r/unpopularopinion/comments/1m0t58w/an_ideal_4day_work_week_would_have_wednesday_off/n3ll846/
n3oxloo,t1_n3by29p,Puzzleheaded_Fuel139,1,"That might be true at first. You'd probably adjust to it. 

For me, I had a 5 day schedule working retail and I had Sunday and Wednesday off. It sucked to never have more than a day off in a row, but it was also nice to never have to work more than 3 days in a row. If I'd only had to do 4 days, it would have been great",1752782494.0,1,https://www.reddit.com/r/unpopularopinion/comments/1m0t58w/an_ideal_4day_work_week_would_have_wednesday_off/n3oxloo/
n3cvgj5,t1_n3by29p,Mathalamus2,-2,"sounds like a mindset issue. when you are off of work, you are *off of work.* it shouldnt even *exist* in your mind.",1752623567.0,1,https://www.reddit.com/r/unpopularopinion/comments/1m0t58w/an_ideal_4day_work_week_would_have_wednesday_off/n3cvgj5/
n3e48am,t1_n3by29p,IrrawaddyWoman,0,Agreed. What crazy person wants a second Sunday instead of a second Saturday?,1752640096.0,1,https://www.reddit.com/r/unpopularopinion/comments/1m0t58w/an_ideal_4day_work_week_would_have_wednesday_off/n3e48am/
n3dtw6w,t1_n3c6xxa,Bubbasdahname,11,"It's a personal preference as I did Wednesdays for 2 years before I worked 5 days a week.  It was rather weird getting the middle of the week off,  but I always enjoyed it.",1752635847.0,1,https://www.reddit.com/r/unpopularopinion/comments/1m0t58w/an_ideal_4day_work_week_would_have_wednesday_off/n3dtw6w/
n3yj7kk,t1_n3c6xxa,stern_m007,2,I got the opportunity to do 4-10 or the regular 5-8 is it worth switching to 4-10?,1752910561.0,1,https://www.reddit.com/r/unpopularopinion/comments/1m0t58w/an_ideal_4day_work_week_would_have_wednesday_off/n3yj7kk/
n3d9ywg,t1_n3bzbtc,SparklingLimeade,118,"The most reasonable progression in work scheduling.

Having one standardized schedule that entire industries all adhere to is crazy. I still don't know how people working classic hours are supposed to go to the bank.",1752628620.0,1,https://www.reddit.com/r/unpopularopinion/comments/1m0t58w/an_ideal_4day_work_week_would_have_wednesday_off/n3d9ywg/
n3dndia,t1_n3bzbtc,Same_Independent_393,18,"When my work moved to a 30 hour work week, we were all able to choose how we used that 30 hours. Most people take Wednesdays off, some take Fridays, and some work 5 short days because they have school aged kids and that's what's easiest for them. The only rule was we all have to be available for a staff meeting every second Tuesday.",1752633371.0,1,https://www.reddit.com/r/unpopularopinion/comments/1m0t58w/an_ideal_4day_work_week_would_have_wednesday_off/n3dndia/
n3df0st,t1_n3bzbtc,Cualkiera67,9,"If everyone has the same days off, it's easier to make plans",1752630395.0,1,https://www.reddit.com/r/unpopularopinion/comments/1m0t58w/an_ideal_4day_work_week_would_have_wednesday_off/n3df0st/
n3exxeb,t1_n3bzbtc,Dani_IT25,3,"This, a thousand times this. 


Need a long weekend for a small trip? This Friday and next Monday off. 

Wanna go hike and not see a soul? Tuesday off. 

Concert or event on Wednesday? Thursday off.",1752656276.0,1,https://www.reddit.com/r/unpopularopinion/comments/1m0t58w/an_ideal_4day_work_week_would_have_wednesday_off/n3exxeb/
n3exlkk,t1_n3bzbtc,DumpsterFireScented,2,"Even with a 5 day week that was always so great at one of my old jobs. I wasn't picky about my days off, just told the manager to keep them separate. It was nice to only have 3 or 2 days before a day off, and one of them was always a weekday so I could easily schedule Dr appointments or whatever.",1752656085.0,1,https://www.reddit.com/r/unpopularopinion/comments/1m0t58w/an_ideal_4day_work_week_would_have_wednesday_off/n3exlkk/
n3fpp4f,t1_n3bzbtc,LuciferFalls,1,Sure. OP chooses Wednesday. Care to comment on that choice?,1752669387.0,1,https://www.reddit.com/r/unpopularopinion/comments/1m0t58w/an_ideal_4day_work_week_would_have_wednesday_off/n3fpp4f/
n3llasy,t1_n3bzbtc,ChokaMoka1,1,How about 7 days off? r/amishfire,1752743516.0,1,https://www.reddit.com/r/unpopularopinion/comments/1m0t58w/an_ideal_4day_work_week_would_have_wednesday_off/n3llasy/
n3jthx7,t1_n3bzbtc,liteshadow4,0,It’s just not practical when other people at work rely on you,1752714295.0,1,https://www.reddit.com/r/unpopularopinion/comments/1m0t58w/an_ideal_4day_work_week_would_have_wednesday_off/n3jthx7/
n3dbn9j,t1_n3byiml,FullDiskclosure,51,"Having done both, I prefer 3 day weekends. During the work week I lock in, then forget about work for 3 full days. If I finish everything early on a Thursday, I can start dinner & laundry so that come closing time my chores are done.

Wednesday’s off we’re nice, but Wednesday night feels like Sunday night. You get more breaks between work days, but you never feel like you have enough time to really forget about work.",1752629213.0,1,https://www.reddit.com/r/unpopularopinion/comments/1m0t58w/an_ideal_4day_work_week_would_have_wednesday_off/n3dbn9j/
n3e5qm9,t1_n3byiml,dasbtaewntawneta,16,"i've done both - wednesday off honestly makes the work week feel so much shorter, it's amazing, but ultimately the possibilities of what a 3 day weekend can provide win out. even if it does make the work week feel more of a slog compared to wednesday off",1752640849.0,1,https://www.reddit.com/r/unpopularopinion/comments/1m0t58w/an_ideal_4day_work_week_would_have_wednesday_off/n3e5qm9/
n3epid6,t1_n3byiml,Command_ofApophis,3,"I don't know about you guys but when there is a holiday in the middle of the week, to me it just feels like the biggest fuckin tease",1752651371.0,1,https://www.reddit.com/r/unpopularopinion/comments/1m0t58w/an_ideal_4day_work_week_would_have_wednesday_off/n3epid6/
n3h0t43,t1_n3byiml,sortofirrelevant,2,The big kick for me is when it comes to holidays. I get all 11 federal holidays and usually 7-8 of those fall on a Monday or Friday. That gives you 7-8 4-day weekends for the year which you can turn into 10 straight days off only using 30 hours of pto,1752684750.0,1,https://www.reddit.com/r/unpopularopinion/comments/1m0t58w/an_ideal_4day_work_week_would_have_wednesday_off/n3h0t43/
n3db16z,t1_n3bzmcs,erebus2161,34,"I think what people often misjudge when comparing this to holidays is that it's every Wednesday, not two or three Wednesdays a year. Having every Wednesday off is a lot different from having a random weekday off in July.


Some people also mention that people usually take a Monday or Friday as PTO. But again, that's different since it is usually planned specifically to have 3 days to go out of town or something like that. That's not something that people do every week.


You can't compare Wednesday's off to holidays and PTO. The only way to really find out how people feel about Wednesdays off is for people to actually try it for a while. Probably 6 months to a year minimum. Wednesday becomes the day you shop, clean, get repairs done, etc. and weekends are finally actual free time.",1752628998.0,1,https://www.reddit.com/r/unpopularopinion/comments/1m0t58w/an_ideal_4day_work_week_would_have_wednesday_off/n3db16z/
n3ebvlq,t1_n3bzmcs,PythagorasNintyOne,3,Yeah sometimes people post stuff I don’t really agree with but I understand. OPs idea here is complete asinine. Maybe they sit in there house all weekend and so they’ve never had to try to plan a weekend getaway to understand that two days vs three is magnitudes difference in what you can accomplish.,1752644037.0,1,https://www.reddit.com/r/unpopularopinion/comments/1m0t58w/an_ideal_4day_work_week_would_have_wednesday_off/n3ebvlq/
n3car8t,t1_n3bzmcs,RightToTheThighs,4,"To be fair July 4th is typically a drinking day, the Wednesday would just be a regular Wednesday",1752616719.0,1,https://www.reddit.com/r/unpopularopinion/comments/1m0t58w/an_ideal_4day_work_week_would_have_wednesday_off/n3car8t/
n3fxiz1,t1_n3bzmcs,iloveregex,1,I’m a teacher. I always try to request my random days off on a Wednesday because we have trouble filling all the jobs M/F. So I agree that Wednesdays off is the unpopular choice given the data. I personally love breaking up the week and everything I want to do on my day off is open Wednesdays.,1752672051.0,1,https://www.reddit.com/r/unpopularopinion/comments/1m0t58w/an_ideal_4day_work_week_would_have_wednesday_off/n3fxiz1/
n3gu7xl,t1_n3bzmcs,therealdanhill,1,Aren't holidays usually just observed on a specific day to avoid the middle of the week issue though? It's been like that wherever I've worked,1752682825.0,1,https://www.reddit.com/r/unpopularopinion/comments/1m0t58w/an_ideal_4day_work_week_would_have_wednesday_off/n3gu7xl/
n3cyohe,t1_n3cpw00,404UserNktFound,10,"I knew someone who worked in an office that had 4 ten-hour days per week, but people’s extra day off rotated through the week. That way there was always someone there, and everyone got fairly balanced numbers of 3-day weekends throughout the year. My friend said those mid-week days off were great for errands like banking (this was 20+ years ago, so less online banking), shopping, post office, etc.",1752624680.0,1,https://www.reddit.com/r/unpopularopinion/comments/1m0t58w/an_ideal_4day_work_week_would_have_wednesday_off/n3cyohe/
n3cyd62,t1_n3cv7lm,Ok_Platypus_1901,4,"Absolutely agree! I work 4 10 hr shifts. My day off rotates, but when it falls on a Wednesday it's amazing. It perfectly breaks up the week",1752624572.0,1,https://www.reddit.com/r/unpopularopinion/comments/1m0t58w/an_ideal_4day_work_week_would_have_wednesday_off/n3cyd62/
n3bypxh,t1_n3bwdvm,PrpleSparklyUnicrn13,66,What do you mean “no more dreading the next day?” So you think people will be looking forward to Tuesdays? Tuesdays will just be the new Monday. Sundays would be just like how Saturday is if Fridays are the days off. ,1752613152.0,1,https://www.reddit.com/r/unpopularopinion/comments/1m0t58w/an_ideal_4day_work_week_would_have_wednesday_off/n3bypxh/
n3c4p10,t1_n3bwdvm,slyroast,7,as a huge football fan Monday is by far the best day to have off,1752614891.0,1,https://www.reddit.com/r/unpopularopinion/comments/1m0t58w/an_ideal_4day_work_week_would_have_wednesday_off/n3c4p10/
n3bzv94,t1_n3bwdvm,rebeccanotbecca,2,"Then I would just dread Tuesday.

Mondays off are the worst.",1752613478.0,1,https://www.reddit.com/r/unpopularopinion/comments/1m0t58w/an_ideal_4day_work_week_would_have_wednesday_off/n3bzv94/
n3ce5eo,t1_n3bwdvm,Ketheres,1,"When it comes to 4 day week discussions my base assumption always is that *everyone* would get the same day off as a baseline. In which case it doesn't matter whether it's monday or friday that is off, 3 day weekend is 3 day weekend. Not that I wouldn't mind letting people chooce their preferred day off or having staggered days off so that some have their day off on mondays, some on wednesdays, and some on fridays. And some would still work weekends with their actual weekend in the middle of the week like they do now. 

Honestly having a more staggeredly scheduled society would be better for a lot of people because then they'd be able to handle their business at banks etc on their days off instead of having to deal with banks being open only within business hours. On the flipside it'd make matching schedules with friends/family harder, but that's already how it is for the people in the service industry; might as well spread the pain instead of focusing it on the people already getting the short end of the stick on most things.",1752617823.0,1,https://www.reddit.com/r/unpopularopinion/comments/1m0t58w/an_ideal_4day_work_week_would_have_wednesday_off/n3ce5eo/
n3cjkvo,t1_n3bwdvm,accidentalscientist_,1,"I used to work Tuesday-Friday with Saturday, Sunday, and Monday off. I miss it so much. It was an ideal work schedule.",1752619657.0,1,https://www.reddit.com/r/unpopularopinion/comments/1m0t58w/an_ideal_4day_work_week_would_have_wednesday_off/n3cjkvo/
n3d2lb3,t1_n3bwdvm,inghostlyjapan,1,"As someone who had a flexible schedule and worked 4 days I tried Friday and Monday but Wednesday gave me the best overall mood boost and was the one I stuck with for years without change. 

It doesn't feel exactly like a weekend as no-one else was taking it off but it was far more relaxing.",1752626049.0,1,https://www.reddit.com/r/unpopularopinion/comments/1m0t58w/an_ideal_4day_work_week_would_have_wednesday_off/n3d2lb3/
n3i267g,t1_n3cjzz1,NitroLSAT,1,"You guys have long weekend trip money?

Nah, as someone who wants to go out to the bar/club/dates/movies/whatever, Wednesday off gives you 5 weekend days: Tuesday (no work tomorrow), Wendesday (new Sunday), Friday (no work tomorrow), Saturday (bliss), and Sunday.

If you pick Friday or Monday, you only get one additional day to do weekend stuff.",1752694992.0,1,https://www.reddit.com/r/unpopularopinion/comments/1m0t58w/an_ideal_4day_work_week_would_have_wednesday_off/n3i267g/
n3xze5w,t1_n3bzg5n,ggginger247,1,I agree! I have a physical job that I never have to “take home” when I’m not there. For me Wednesdays off is amazing because I get to physically rest and get some chores done.,1752900179.0,1,https://www.reddit.com/r/unpopularopinion/comments/1m0t58w/an_ideal_4day_work_week_would_have_wednesday_off/n3xze5w/
n3byiks,t1_n3bvezt,anomie89,12,nah. last years Christmas and new years was bullshit. felt like I was scammed with the Wednesday holidays.,1752613095.0,1,https://www.reddit.com/r/unpopularopinion/comments/1m0t58w/an_ideal_4day_work_week_would_have_wednesday_off/n3byiks/
n3doeld,t1_n3c08n4,Same_Independent_393,2,"I have Wednesdays off too, it's the greatest. You don't get Mondayitis because I only have to work 2 days before you get another one off.",1752633753.0,1,https://www.reddit.com/r/unpopularopinion/comments/1m0t58w/an_ideal_4day_work_week_would_have_wednesday_off/n3doeld/
n3jvnnz,t1_n3c08n4,kriknik0007,1,"Did you know if you had either Friday or Monday off work, you could take 2 days off and have a 5 day weekend? Lol",1752715067.0,1,https://www.reddit.com/r/unpopularopinion/comments/1m0t58w/an_ideal_4day_work_week_would_have_wednesday_off/n3jvnnz/
n3gv5dh,t1_n3dkug0,Thatguyyoupassby,3,"Economically speaking, Wednesday is probably better as well. 

You now have people dining out on Tuesday (off the next day), Wednesday (off), Friday (off the next day), Saturday (off), Sunday (off). Thursday would likely still be a fairly popular day as well. 

Right now, Monday-Wednesday are duds. 

Giving people Friday off adds a bit of volume on Thursday, but Mon-Wed are still dead. 

Mondays off mean more volume monday, but zero change to Tues-Thurd. 

Wednesday off is the only day that adds 2+ days for businesses to thrive. 

Great for restaurants, retail, etc.",1752683116.0,1,https://www.reddit.com/r/unpopularopinion/comments/1m0t58w/an_ideal_4day_work_week_would_have_wednesday_off/n3gv5dh/
n3rukqj,t1_n3byizq,vilaymignon,2,THIS!!,1752820956.0,1,https://www.reddit.com/r/unpopularopinion/comments/1m0t58w/an_ideal_4day_work_week_would_have_wednesday_off/n3rukqj/
n3dbtro,t1_n3bwgfo,erebus2161,9,This only works if your job doesn't depend on any of your coworkers to be working at the same time as you.,1752629277.0,1,https://www.reddit.com/r/unpopularopinion/comments/1m0t58w/an_ideal_4day_work_week_would_have_wednesday_off/n3dbtro/
n3dkjf2,t1_n3bwgfo,mb9981,1,"This is my argument. A lot of people are going to get monkey pawed when their new schedule includes Saturdays and Sundays because the concept of ""weekend"" is now meaningless",1752632335.0,1,https://www.reddit.com/r/unpopularopinion/comments/1m0t58w/an_ideal_4day_work_week_would_have_wednesday_off/n3dkjf2/
n3c3h40,t1_n3bwgfo,IntrovertedBluebird,1,I like this idea better. Everyone picks what 4 they want to work.,1752614527.0,1,https://www.reddit.com/r/unpopularopinion/comments/1m0t58w/an_ideal_4day_work_week_would_have_wednesday_off/n3c3h40/
n3c1o0p,t1_n3c0wxm,its_not_you_its_ye,-3,"A 3 day road trip is sad - too short. You’d want to take PTO anyways, in which case 2 PTO days off gives 5 days free in any 4 day system.",1752613996.0,1,https://www.reddit.com/r/unpopularopinion/comments/1m0t58w/an_ideal_4day_work_week_would_have_wednesday_off/n3c1o0p/
n3byg1e,t1_n3bw8m4,Jazzlike-Basket-6388,1,"I had something similar.  I had to burn a bunch of PTO before the year end, but couldn't take a chunk of time off because of others.  So I took a Tuesday or Wednesday off (we work 4/10's) for basically the last 3 months of the year.  And it was great.",1752613075.0,1,https://www.reddit.com/r/unpopularopinion/comments/1m0t58w/an_ideal_4day_work_week_would_have_wednesday_off/n3byg1e/
n3db5ra,t1_n3d7zvq,lumiranswife,1,"I could definitely see that! Although, if the kids are school age it is nice to have the house to one's self on a Wednesday while the family is out. Come to think of it.. a Fri/Mon off also gives the same quiet in the house, so I must really just be chasing the midweek break.

I used to have Wed and Fri off but Fridays were becoming so lucrative (ironically with the people I see getting Fridays off or wfh to meet with me), so I started at a half day and eventually it became my most booked one in my practice. But even then, I surprisingly get way more done on Fridays because I am already moving and can keep that energy going, so my weekends became way more relaxed because I'd get many weekend things done beforehand. 

But you couldn't pry my Wednesdays off out of my cold, dead hands. I let it be my non-starter day, sometimes I get other volunteer work done, sometimes I catch up, sometimes the cat and I just sleep and scroll my phone. Having two days of work and then a break then two more and a break is the right energy for me (of course, not for everybody). That day of nobody around is energy replenishing to me.

When a holiday falls on a Monday or Friday that extended weekend does feel really great, but I think I appreciate it more as a one-off than my regular routine.",1752629041.0,1,https://www.reddit.com/r/unpopularopinion/comments/1m0t58w/an_ideal_4day_work_week_would_have_wednesday_off/n3db5ra/
