comment_id,parent_id,author,score,body,created_utc,depth,permalink
n3bukwv,t3_1m0t58w,AutoModerator,1,"Please remember what subreddit you are in, this is unpopular opinion. We want civil and unpopular takes and discussion. Any uncivil and ToS violating comments will be removed and subject to a ban. Have a nice day!


*I am a bot, and this action was performed automatically. Please [contact the moderators of this subreddit](/message/compose/?to=/r/unpopularopinion) if you have any questions or concerns.*",1752612005.0,0,https://www.reddit.com/r/unpopularopinion/comments/1m0t58w/an_ideal_4day_work_week_would_have_wednesday_off/n3bukwv/
n3bwbdo,t3_1m0t58w,youchasechickens,5086,"Upvote, I just recently lost my 3 day weekends. I miss them dearly. Three days off in a row actually starts to feel like a break from work.",1752612485.0,0,https://www.reddit.com/r/unpopularopinion/comments/1m0t58w/an_ideal_4day_work_week_would_have_wednesday_off/n3bwbdo/
n3byyoj,t3_1m0t58w,hezthebest,827,"I did 4-10s with Wednesdays off for a few years and it was amazing! Didn’t feel like I had to play catch up when got back in to work on Thursday and weekends were free for the most point since appointments, errands and chores could be done mid week. Always said I had 2 Mondays and 2 Fridays.",1752613219.0,0,https://www.reddit.com/r/unpopularopinion/comments/1m0t58w/an_ideal_4day_work_week_would_have_wednesday_off/n3byyoj/
n3bv80p,t3_1m0t58w,sunnysam306,1344,Extra liked because 3 day weekends are amazing,1752612183.0,0,https://www.reddit.com/r/unpopularopinion/comments/1m0t58w/an_ideal_4day_work_week_would_have_wednesday_off/n3bv80p/
n3by29p,t3_1m0t58w,SkullLeader,739,"I disagree.  Yea, a 3 day weekend is too short.  But I’d rather be able to forget about work for three days than two plus another random day where I’ll probably be thinking about it all day anyway.",1752612970.0,0,https://www.reddit.com/r/unpopularopinion/comments/1m0t58w/an_ideal_4day_work_week_would_have_wednesday_off/n3by29p/
n3c6xxa,t3_1m0t58w,RangerFricke,64,"My job does 4-10 hour days.  One of my coworkers did this schedule for a little bit (work 2 days, 1 off, work 2 days, 2 off).  He switched back to 3 day weekend after a few months.",1752615558.0,0,https://www.reddit.com/r/unpopularopinion/comments/1m0t58w/an_ideal_4day_work_week_would_have_wednesday_off/n3c6xxa/
n3bzbtc,t3_1m0t58w,Maleficent_Box_5111,291,I think you should be able to choose your days off. ,1752613323.0,0,https://www.reddit.com/r/unpopularopinion/comments/1m0t58w/an_ideal_4day_work_week_would_have_wednesday_off/n3bzbtc/
n3byiml,t3_1m0t58w,GenericFatGuy,118,"I'm torn. It would be nice to have 3-day weekends all the time, but it would also be nice to never work more than two days in a row.",1752613095.0,0,https://www.reddit.com/r/unpopularopinion/comments/1m0t58w/an_ideal_4day_work_week_would_have_wednesday_off/n3byiml/
n3bzmcs,t3_1m0t58w,berniek9,90,As an employer of 12 employees.  This is an unpopular choice.  Mondays and Fridays are the most requested days off.  Also the staff hates it when a holiday lands in the middle of the week instead of a friday and monday.  Everyone loved july 4 being on a friday this year.,1752613406.0,0,https://www.reddit.com/r/unpopularopinion/comments/1m0t58w/an_ideal_4day_work_week_would_have_wednesday_off/n3bzmcs/
n3bxkp6,t3_1m0t58w,Lornesto,24,"I've done both. Friday off, and a 3 day weekend every weekend, is far superior.",1752612834.0,0,https://www.reddit.com/r/unpopularopinion/comments/1m0t58w/an_ideal_4day_work_week_would_have_wednesday_off/n3bxkp6/
n3cpw00,t3_1m0t58w,Ollie-Arrow-1290,37,"I had that schedule years ago (four 10-hour days).  I absolutely loved it.  I also loved my job at the time, so 10-hour days were easy.

I used Wednesdays as my ""errand day"" (cleaning, groceries, appointments, etc.).  Some Wednesdays I'd just watch movies & play video games.  Damn I miss that schedule & my ""TuesdayFriday"".",1752621722.0,0,https://www.reddit.com/r/unpopularopinion/comments/1m0t58w/an_ideal_4day_work_week_would_have_wednesday_off/n3cpw00/
n3cv7lm,t3_1m0t58w,Snortykins,17,"As someone who works 4 days a week and gets to choose my own shift plan: I couldn't agree more.

Monday, Tuesday, Thursday, Friday is peak! Never having more than two work days in a row is a game-changer.",1752623483.0,0,https://www.reddit.com/r/unpopularopinion/comments/1m0t58w/an_ideal_4day_work_week_would_have_wednesday_off/n3cv7lm/
n3bwdvm,t3_1m0t58w,dlc741,86,"Wednesday is the second choice. Monday is the correct one because you get all day Sunday. No more dreading the next day, no more turning in because you have to get up early. You get to enjoy all day Saturday, all day Sunday, and Mondays are now great because everyone else is at work and you're sleeping in and taking it easy. 

""Feels too short"" is nonsense. Compared to what? A week's vacation? of course because it's less than a week. Compared to a two day weekend and one day in the middle of the week? Whatever. Want to have a quick get-away? Leave Friday after work, get all day Saturday and Sunday, and a leisurely return home on Monday.

It sounds like idle speculation and not like you have no experience with a 4-day week. But have an upvote for being unpopular AND wrong.",1752612504.0,0,https://www.reddit.com/r/unpopularopinion/comments/1m0t58w/an_ideal_4day_work_week_would_have_wednesday_off/n3bwdvm/
n3cjzz1,t3_1m0t58w,TheSpideyJedi,10,Nah I’d want as many days off in a row as possible. Makes long weekend trips possible,1752619793.0,0,https://www.reddit.com/r/unpopularopinion/comments/1m0t58w/an_ideal_4day_work_week_would_have_wednesday_off/n3cjzz1/
n3bxc6a,t3_1m0t58w,zookeeper4312,13,"Agree, breaks up the week perfectly",1752612767.0,0,https://www.reddit.com/r/unpopularopinion/comments/1m0t58w/an_ideal_4day_work_week_would_have_wednesday_off/n3bxc6a/
n3bzg5n,t3_1m0t58w,Due_Ring1435,8,"Nope! 

Just had two weeks with a mid-week day off and it was the worst. A 3-day weekend really allows me to unplug. 

I guess it depends if you have a physical job, then a midweek breal makes sense.",1752613357.0,0,https://www.reddit.com/r/unpopularopinion/comments/1m0t58w/an_ideal_4day_work_week_would_have_wednesday_off/n3bzg5n/
n3bvezt,t3_1m0t58w,sal-t_brgr,29,I highly agree! Wednesday off is the superior choice,1752612237.0,0,https://www.reddit.com/r/unpopularopinion/comments/1m0t58w/an_ideal_4day_work_week_would_have_wednesday_off/n3bvezt/
n3bw91l,t3_1m0t58w,tessaemilybrown,7,100%! It is exhausting to work days in a row waiting for weekend. Breaking it down would be more relaxing and managable.,1752612467.0,0,https://www.reddit.com/r/unpopularopinion/comments/1m0t58w/an_ideal_4day_work_week_would_have_wednesday_off/n3bw91l/
n3bxq08,t3_1m0t58w,sphynxzyz,6,"fuck that, 2 days on 1 day off 2 days one 2 days off. Too many times I'd wake up and work on wednesday just keep the days off combined.",1752612875.0,0,https://www.reddit.com/r/unpopularopinion/comments/1m0t58w/an_ideal_4day_work_week_would_have_wednesday_off/n3bxq08/
n3c08n4,t3_1m0t58w,Odd-Donut300,7,I’ve had Wednesdays off for ten years now and I would never ever go back. Love it. And I can take two days off to get a five day weekend. It’s pretty sweet,1752613584.0,0,https://www.reddit.com/r/unpopularopinion/comments/1m0t58w/an_ideal_4day_work_week_would_have_wednesday_off/n3c08n4/
n3c4q6a,t3_1m0t58w,broidx,6,who wants 2 'Mondays' a week? 3 day weekends are glorious. take Mondays off and miss the weekend clean up.,1752614900.0,0,https://www.reddit.com/r/unpopularopinion/comments/1m0t58w/an_ideal_4day_work_week_would_have_wednesday_off/n3c4q6a/
n3dkug0,t3_1m0t58w,mattdiamante,6,"Wednesday IS the best day. I run my own agency and did a trial back in 2021 for the summer to see how it would go… kept my team paid full time but took us down to 4 days per week… 8 hour days.. and the output was so good that we kept doing it ever since! 

And not only that.. the team is happier, they do better work, and the clients are happier (and seeing better results!) 

I figure with Wednesday off you’re always 1-2 days away from a day where you can do nothing all day.. or run errands, go to appointments.. or whatever you want really. 

And to top it all off my business exploded from like 500k to 2M+ per year.. all while working 4 days a week. Crazy.",1752632447.0,0,https://www.reddit.com/r/unpopularopinion/comments/1m0t58w/an_ideal_4day_work_week_would_have_wednesday_off/n3dkug0/
n3byizq,t3_1m0t58w,PistachiNO,21,"I emphatically agree with this person so I am downvoting them

Edit: I've worked a 4-day week like this for a while before, and as an ADHD person I can't tell you how RELIEVING it is knowing I never have more than two days of work before I get a break.",1752613098.0,0,https://www.reddit.com/r/unpopularopinion/comments/1m0t58w/an_ideal_4day_work_week_would_have_wednesday_off/n3byizq/
n3c19s0,t3_1m0t58w,Top-Coat3026,5,"Naw dog, that would turn wednesday into a far less useful wad of time. It's way more productive to lump time blocks together. You could accomplish exponentially more with your time in 3 continuous days than you can with 2 days here and a few hours there.",1752613880.0,0,https://www.reddit.com/r/unpopularopinion/comments/1m0t58w/an_ideal_4day_work_week_would_have_wednesday_off/n3c19s0/
n3c2m0j,t3_1m0t58w,Kvsav57,3,Hard disagree. That means I have to dread going to work the next day more often.,1752614273.0,0,https://www.reddit.com/r/unpopularopinion/comments/1m0t58w/an_ideal_4day_work_week_would_have_wednesday_off/n3c2m0j/
n3c66co,t3_1m0t58w,leafmealone303,4,"I disagree. I like having Friday off in my 4 day school week. It’s easier to plan weekend trips. If you take Thursday and Monday off, it works out amazingly.",1752615334.0,0,https://www.reddit.com/r/unpopularopinion/comments/1m0t58w/an_ideal_4day_work_week_would_have_wednesday_off/n3c66co/
n3cifwa,t3_1m0t58w,kitfoxxxx,3,Hard agree. The mid week buffer would help.,1752619287.0,0,https://www.reddit.com/r/unpopularopinion/comments/1m0t58w/an_ideal_4day_work_week_would_have_wednesday_off/n3cifwa/
n3bwgfo,t3_1m0t58w,notwalkinghere,10,"Should just let people pick which 4 days out of 7 are their weekdays. Weeks are already an arbitrary construct, there's no reason we need to all have the same weekdays and weekends.",1752612524.0,0,https://www.reddit.com/r/unpopularopinion/comments/1m0t58w/an_ideal_4day_work_week_would_have_wednesday_off/n3bwgfo/
n3c0wxm,t3_1m0t58w,FingerBlaster70,9,Nothing like cutting a road trip a day short cause this guy wanted Wednesday off,1752613777.0,0,https://www.reddit.com/r/unpopularopinion/comments/1m0t58w/an_ideal_4day_work_week_would_have_wednesday_off/n3c0wxm/
n3c1b87,t3_1m0t58w,oooh_a_plane,6,"Nah, having a random day off in the middle of the week would be a waste of time. You won't do much Tuesday evening, because you're tired after work and you can't stay out too late on Wednesday, because you gotta go to work on Thursday.",1752613892.0,0,https://www.reddit.com/r/unpopularopinion/comments/1m0t58w/an_ideal_4day_work_week_would_have_wednesday_off/n3c1b87/
n3c4t52,t3_1m0t58w,surfmonkey17,6,I work 4 days a week.  I prefer to have my days off all together as it allows us to go away more often. We like to camp or go for a weekend at the casino or just go into the big city and get a room for the weekend. These little trips feel like mini-vacations and are so relaxing as we unplug for the 3 days and I forget all about work. I would hate to have my days off broken up as then I wouldn’t be able to go anywhere and enjoy my time off.,1752614925.0,0,https://www.reddit.com/r/unpopularopinion/comments/1m0t58w/an_ideal_4day_work_week_would_have_wednesday_off/n3c4t52/
n3byol5,t3_1m0t58w,RocMerc,3,That would be the life ngl,1752613142.0,0,https://www.reddit.com/r/unpopularopinion/comments/1m0t58w/an_ideal_4day_work_week_would_have_wednesday_off/n3byol5/
n3byqv7,t3_1m0t58w,sinistergzus,3,"I’ve always said this. Wednesday is THE best day of the week to have off. It’s usually quieter in public spaces. Gives you only 2 days to work in a row. Good rest day so weekends can be more productive. If I’m using vacation time, it’s on a frickin Wednesday",1752613159.0,0,https://www.reddit.com/r/unpopularopinion/comments/1m0t58w/an_ideal_4day_work_week_would_have_wednesday_off/n3byqv7/
n3bz5aw,t3_1m0t58w,Dave_A480,3,"Disagree.

Having a single day off in the middle of the week is almost useless.  
This is why we 'observe' holidays on the first-monday, rather than midweek.

If I am going to work 4 10hr days (because let's be real: Nobody's going to pay you for 40hrs of work and let you just do 32), then they might as well be T-F or M-TH so I can have 1 day to sleep in & 2 to get hobby-stuff done (or 3, if I'm not super tired)....

Also my ability to get stuff done at work would be messed up by a mid-week break.",1752613271.0,0,https://www.reddit.com/r/unpopularopinion/comments/1m0t58w/an_ideal_4day_work_week_would_have_wednesday_off/n3bz5aw/
n3bzizr,t3_1m0t58w,SnarkyFool,3,"I like Mondays off the best. 

If you want to do a little weekend getaway, Saturday morning to Monday night is usually an easy time to travel.",1752613379.0,0,https://www.reddit.com/r/unpopularopinion/comments/1m0t58w/an_ideal_4day_work_week_would_have_wednesday_off/n3bzizr/
n3c1tme,t3_1m0t58w,Contemplating_Prison,3,3 days off in a row is more relaxing. 1 day for errands. 1 day for partying/fun. 1 day for resting.,1752614041.0,0,https://www.reddit.com/r/unpopularopinion/comments/1m0t58w/an_ideal_4day_work_week_would_have_wednesday_off/n3c1tme/
n3cqwwo,t3_1m0t58w,nowarac,3,"I've heard one of the Scandanavian countries (I think?) - or at least some employers - give Wedneaday of. It's referred to as ""Little Saturday"". I love that idea.",1752622062.0,0,https://www.reddit.com/r/unpopularopinion/comments/1m0t58w/an_ideal_4day_work_week_would_have_wednesday_off/n3cqwwo/
n3cv6tm,t3_1m0t58w,FreddyKrueger32,3,I already have Wednesday off (retail) and it's nice being able to do things when most are at work. Less crowds and people. We don't ever get a three day weekend. Take your three days off and enjoy it.,1752623476.0,0,https://www.reddit.com/r/unpopularopinion/comments/1m0t58w/an_ideal_4day_work_week_would_have_wednesday_off/n3cv6tm/
n3d4019,t3_1m0t58w,Crew_1996,3,"Wednesdays are the best. Never work more than 2 days in a row. Tuesday is also Saturday, 


I work Monday Tuesday Friday and it is the best imo. Monday sucks still but Tuesday is now Friday, Wednesday and Thursday are a new weekend, Friday is still Friday and Saturday and Sunday are still the weekend.",1752626538.0,0,https://www.reddit.com/r/unpopularopinion/comments/1m0t58w/an_ideal_4day_work_week_would_have_wednesday_off/n3d4019/
n3bw8m4,t3_1m0t58w,NoahtheRed,2,"I agree. A former employer had a use it or lose it policy with PTO, but Fridays and Mondays were more difficult to take off because they tended to be busier for me...so I'd start taking Wednesdays off towards the end of the year. It was AMAZING. Not working more than 2 days in a row was great because I'd feel nice and refreshed. I still have my normal weekends for weekend shenanigans, but having a day mid-week to get errands and stuff done was great. 

Of course, the issue is if EVERYONE is off Wednesday, all the stuff that was convenient to do then is now less convenient...since everyone else is out, too.",1752612464.0,0,https://www.reddit.com/r/unpopularopinion/comments/1m0t58w/an_ideal_4day_work_week_would_have_wednesday_off/n3bw8m4/
n3bxe4c,t3_1m0t58w,condoulo,2,"I have worked different varieties of four day weeks in a previous role of mine. Sun-Wed, Tues-Fri, Wed-Sat (ugh), Mon-Thurs, and of course the ""donut"" which has Wednesday off. Based on my experience I would definitely agree with you if you're working a day shift. On nights though? Just let me have my three days off in a row.",1752612783.0,0,https://www.reddit.com/r/unpopularopinion/comments/1m0t58w/an_ideal_4day_work_week_would_have_wednesday_off/n3bxe4c/
n3bxnu5,t3_1m0t58w,zenon10,2,"I had a work schedule similar to this once, and it did feel better than all days off in a row.",1752612858.0,0,https://www.reddit.com/r/unpopularopinion/comments/1m0t58w/an_ideal_4day_work_week_would_have_wednesday_off/n3bxnu5/
n3byr65,t3_1m0t58w,NoGuarantee3961,2,"Hard disagree.  Three days in a row offers a lot more opportunities, longer driving times, etc.

What is even better, however, is the staggered 4 day workweek.  Mon to Thurs one week, Tue to Friday the next.  Every other weekend is a 4 day weekend.  I had this schedule in a factory when I was in undergrad, and it was awesome.",1752613161.0,0,https://www.reddit.com/r/unpopularopinion/comments/1m0t58w/an_ideal_4day_work_week_would_have_wednesday_off/n3byr65/
n3bz2b1,t3_1m0t58w,XAMdG,2,"Finally, a rational person.",1752613248.0,0,https://www.reddit.com/r/unpopularopinion/comments/1m0t58w/an_ideal_4day_work_week_would_have_wednesday_off/n3bz2b1/
n3bz35f,t3_1m0t58w,FMLitsAJ,2,I want all 3 days off together.,1752613254.0,0,https://www.reddit.com/r/unpopularopinion/comments/1m0t58w/an_ideal_4day_work_week_would_have_wednesday_off/n3bz35f/
n3bzbtq,t3_1m0t58w,DanielReddit26,2,What a truly unpopular opinion.,1752613323.0,0,https://www.reddit.com/r/unpopularopinion/comments/1m0t58w/an_ideal_4day_work_week_would_have_wednesday_off/n3bzbtq/
n3bzgbl,t3_1m0t58w,Smitch250,2,Ummm hell no,1752613359.0,0,https://www.reddit.com/r/unpopularopinion/comments/1m0t58w/an_ideal_4day_work_week_would_have_wednesday_off/n3bzgbl/
n3c13b7,t3_1m0t58w,huey2k2,2,Gross,1752613829.0,0,https://www.reddit.com/r/unpopularopinion/comments/1m0t58w/an_ideal_4day_work_week_would_have_wednesday_off/n3c13b7/
n3cw7tz,t3_1m0t58w,TurnoverAdditional65,2,"I had this shift 25 years ago, I loved it..  Monday/Tuesday 10 hour days, off Wednesday, Thursday/Friday 10 hour days, off Saturday and Sunday.  Going in on Monday or Thursday was from a day off, so felt good.  Then Tuesday/Friday immediately felt good because I had the next day off.

If I were to ever get a 4-day workweek and was given the choice of day off, it's Wednesday every time.  Does this mean I have to downvote the post if I agree?  :D",1752623828.0,0,https://www.reddit.com/r/unpopularopinion/comments/1m0t58w/an_ideal_4day_work_week_would_have_wednesday_off/n3cw7tz/
n3d1dcm,t3_1m0t58w,IdeaMotor9451,2,"Everyone should have a different schedule. I would like a day off that dentists/doctors don't have off, but not at their expense.",1752625616.0,0,https://www.reddit.com/r/unpopularopinion/comments/1m0t58w/an_ideal_4day_work_week_would_have_wednesday_off/n3d1dcm/
n3d3v9z,t3_1m0t58w,AggressiveMail5183,2,"All holidays should be on Fridays.  Then Thursdays become Fridays, which is pretty good because TGIF.  Then Fridays become Saturdays, the best day.  Then you get an extra Saturday on Saturday.  Then you get a Sunday, which is pretty good but not as good as Saturday because you have to go back to work the next day.  Holidays on Monday aren't as good, you just get a regular Friday, then a regular Saturday, then you get Sunday and an extra Sunday on Monday.  The first Sunday is kind of like a Saturday, but not really because you still think of it as a Sunday.  Then the Monday is like a Sunday because you have to go to work the next day.",1752626491.0,0,https://www.reddit.com/r/unpopularopinion/comments/1m0t58w/an_ideal_4day_work_week_would_have_wednesday_off/n3d3v9z/
n3d6efn,t3_1m0t58w,Bearbearcave,2,I have Wednesday off and I love it!! Plus the added benefit of making it super easy to schedule dr. appointments AND if Monday is a holiday and I take Tuesday off I can get a 5 day weekend for 1 day of PTO.,1752627367.0,0,https://www.reddit.com/r/unpopularopinion/comments/1m0t58w/an_ideal_4day_work_week_would_have_wednesday_off/n3d6efn/
n3d6m9o,t3_1m0t58w,allnamestaken1968,2,"Here! Here! When I went to 80% a few years before retirement, that’s exactly what I did. Wednesday’s off. Never more than 48 hrs before a day off! Incredibly awesome. 

Add: When I had to travel, I moved it to Friday - so I had that as well on occasion.",1752627443.0,0,https://www.reddit.com/r/unpopularopinion/comments/1m0t58w/an_ideal_4day_work_week_would_have_wednesday_off/n3d6m9o/
n3d6sh8,t3_1m0t58w,SewGangsta,2,"I used to work this shift and it was the best, I felt like I only worked 2 days a week and was always refreshed and able to work at 100%.",1752627502.0,0,https://www.reddit.com/r/unpopularopinion/comments/1m0t58w/an_ideal_4day_work_week_would_have_wednesday_off/n3d6sh8/
n3d72c8,t3_1m0t58w,Accidental-loaf,2,"I didn't think this would be unpopular, I agree. I used to do this and it was so nice to have a day in the middle of the week to get chores and errands done. Made the weekends feel more free.",1752627597.0,0,https://www.reddit.com/r/unpopularopinion/comments/1m0t58w/an_ideal_4day_work_week_would_have_wednesday_off/n3d72c8/
n3d78pd,t3_1m0t58w,Intelligent_Bite_323,2,I had this schedule when i was in amazon with Wednesday Saturday Sunday off. And now i have Friday to Sunday off with different company I work at. Honestly I prefer Friday to Sunday more. Every weekend feels like a long weekend.,1752627658.0,0,https://www.reddit.com/r/unpopularopinion/comments/1m0t58w/an_ideal_4day_work_week_would_have_wednesday_off/n3d78pd/
n3d7zvq,t3_1m0t58w,DogsRuleTheWorld666,2,I think it's ppl with kids who like the 3 day weekend. I don't know any parents who are able to plan catching up on sleep. ,1752627922.0,0,https://www.reddit.com/r/unpopularopinion/comments/1m0t58w/an_ideal_4day_work_week_would_have_wednesday_off/n3d7zvq/
n3dco7n,t3_1m0t58w,None,2,[deleted],1752629580.0,0,https://www.reddit.com/r/unpopularopinion/comments/1m0t58w/an_ideal_4day_work_week_would_have_wednesday_off/n3dco7n/
n3dcobg,t3_1m0t58w,MikeyMBCA,2,"Testify, my brother!!

I have been saying this for years.

Another benefit is that since most long weekends are celebrated on either a Friday or Monday, we dont lose out or our genuine long-weekends by making them just another 3 day weekend.",1752629581.0,0,https://www.reddit.com/r/unpopularopinion/comments/1m0t58w/an_ideal_4day_work_week_would_have_wednesday_off/n3dcobg/
n3ddfmh,t3_1m0t58w,SuperNerdDad,2,"I agree with this. 

Some people aren’t thinking about all the stuff you can in the middle of the week. That could be doctor appointments. Bank stuff. I wouldn’t want to do that during my normal 3 day weekend. But a day in the middle to get stuff done. Perfect.",1752629847.0,0,https://www.reddit.com/r/unpopularopinion/comments/1m0t58w/an_ideal_4day_work_week_would_have_wednesday_off/n3ddfmh/
n3ddjf2,t3_1m0t58w,bubulubu30,2,My job offers those options some work sun-wed(front half) or wed-sat (back half) some are  mon tue thur Fri (donut),1752629883.0,0,https://www.reddit.com/r/unpopularopinion/comments/1m0t58w/an_ideal_4day_work_week_would_have_wednesday_off/n3ddjf2/
n3djrir,t3_1m0t58w,TarnishedWizeFinger,2,I don't need another Sunday in my week,1752632056.0,0,https://www.reddit.com/r/unpopularopinion/comments/1m0t58w/an_ideal_4day_work_week_would_have_wednesday_off/n3djrir/
n3djtlg,t3_1m0t58w,TsuDhoNimh2,2,How about working 8/6 so you have a big chunk of free time every other week?,1752632076.0,0,https://www.reddit.com/r/unpopularopinion/comments/1m0t58w/an_ideal_4day_work_week_would_have_wednesday_off/n3djtlg/
n3dql4o,t3_1m0t58w,theFooMart,2,"I suppose it’s all subjective. As someone who rarely gets two consecutive days off, I got used to having my work week broken up and now look forward to it. I don’t like having consecutive days off unless I have plans to travel or something like that.",1752634569.0,0,https://www.reddit.com/r/unpopularopinion/comments/1m0t58w/an_ideal_4day_work_week_would_have_wednesday_off/n3dql4o/
n3drtiy,t3_1m0t58w,Reitter3,2,This all falls apart a soon as you start to think about weekend travel,1752635042.0,0,https://www.reddit.com/r/unpopularopinion/comments/1m0t58w/an_ideal_4day_work_week_would_have_wednesday_off/n3drtiy/
n3e0qy0,t3_1m0t58w,flappypancaker,2,"Fuckin hell that’s a well articulated argument, 10/10 OP you sold me",1752638582.0,0,https://www.reddit.com/r/unpopularopinion/comments/1m0t58w/an_ideal_4day_work_week_would_have_wednesday_off/n3e0qy0/
n3ea3xp,t3_1m0t58w,artisinal_lethargy,2,"The only reason Wednesday is the optimal day is because there are less people on the slopes on Wednesday. 

The optimal is to take alternating Monday and Fridays off so you get 4 day weekends off every other week.",1752643138.0,0,https://www.reddit.com/r/unpopularopinion/comments/1m0t58w/an_ideal_4day_work_week_would_have_wednesday_off/n3ea3xp/
n3ebm2m,t3_1m0t58w,Tye_die,2,"I must upvote because I vehemently disagree. I've worked the three day weekend and I worked your preferred way when I was a supervisor in retail. Horrible. The on and off of it all made it hard to get anything done. I had a two day weekend and then the in between day was just a lost day. In no other period of my life have I felt like I lost so much time than that period, and I've worked the overnight shift. For me the three day weekend is the way to go. One day to get all of the menial human tasks done, two to rest and enjoy life.",1752643902.0,0,https://www.reddit.com/r/unpopularopinion/comments/1m0t58w/an_ideal_4day_work_week_would_have_wednesday_off/n3ebm2m/
